Track Name,Artist Name,Lyrics,Writers,Producers,Genius_ID,danceability,energy,key,loudness,mode,speechiness,acousticness,instrumentalness,liveness,valence,tempo,type,id,uri,track_href,analysis_url,duration_ms,time_signature,clean_lyrics,Popularity
Blank Space (Taylor's Version),Taylor Swift,"33 ContributorsTranslationsItalianoСрпскиTürkçeMagyarEspañolPortuguêsУкраїнськаFrançais日本語PolskiSvenskaDeutschSlovenščinaBlank Space (Taylor’s Version) Lyrics[Verse 1]
Nice to meet you, where you been?
I could show you incredible things
Magic, madness, heaven, sin
Saw you there and I thought
""Oh, my God, look at that face
You look like my next mistake
Love's a game, wanna play?"" Ayy
New money, suit and tie
I can read you like a magazine
Ain't it funny? Rumors fly
And I know you heard about me
So, hey, let's be friends
I'm dyin' to see how this one ends
Grab your passport and my hand
I can make the bad guys good for a weekend
[Chorus]
So it's gonna be forever
Or it's gonna go down in flames?
You can tell me when it's over, mm
If the high was worth thе pain
Got a long list of ex-lovers
They'll tеll you I'm insane
'Cause you know I love the players
And you love the game
'Cause we're young and we're reckless
We'll take this way too far
It'll leave you breathless, mm
Or with a nasty scar
Got a long list of ex-lovers
They'll tell you I'm insane
But I've got a blank space, baby
And I'll write your name
See Taylor Swift LiveGet tickets as low as $446You might also like[Verse 2]
Cherry lips, crystal skies
I could show you incredible things
Stolen kisses, pretty lies
You're the king, baby, I'm your queen
Find out what you want
Be that girl for a month
Wait, the worst is yet to come, oh, no
Screaming, crying, perfect storms
I can make all the tables turn
Rose garden filled with thorns
Keep you second guessin', like
""Oh, my God, who is she?""
I get drunk on jealousy
But you'll come back each time you leave
'Cause, darling, I'm a nightmare dressed like a daydream

[Chorus]
So it's gonna be forever
Or it's gonna go down in flames?
You can tell me when it's over, mm
If the high was worth the pain
Got a long list of ex-lovers
They'll tell you I'm insane
'Cause you know I love the players
And you love the game
'Cause we're young and we're reckless (Oh)
We'll take this way too far
It'll leave you breathless (Oh-oh), mm
Or with a nasty scar
Got a long list of ex-lovers
They'll tell you I'm insane (Insane)
But I've got a blank space, baby
And I'll write your name
[Bridge]
Boys only want love if it's torture
Don't say I didn't, say I didn't warn ya
Boys only want love if it's torture
Don't say I didn't, say I didn't warn ya

[Chorus]
So it's gonna be forever
Or it's gonna go down in flames?
You can tell me when it's over (Over), mm
If the high was worth the pain
Got a long list of ex-lovers
They'll tell you I'm insane (I'm insane)
'Cause you know I love the players
And you love the game (Love the game)
'Cause we're young and we're reckless (Yeah)
We'll take this way too far (Ooh)
It'll leave you breathless, mm
Or with a nasty scar (Or leave a nasty scar)
Got a long list of ex-lovers
They'll tell you I'm insane
But I've got a blank space, baby
And I'll write your nameEmbed","['Max Martin', 'Shellback', 'Taylor Swift']","['Christopher Rowe', 'Taylor Swift']",6688260,0.732,0.719,0,-5.469,1,0.0645,0.0901,0.0,0.331,0.71,96.035,audio_features,45wMBGri1PORPjM9PwFfrS,spotify:track:45wMBGri1PORPjM9PwFfrS,https://api.spotify.com/v1/tracks/45wMBGri1PORPjM9PwFfrS,https://api.spotify.com/v1/audio-analysis/45wMBGri1PORPjM9PwFfrS,231833,4," nice to meet you, where you been? i could show you incredible things magic, madness, heaven, sin saw you there and i thought ""oh, my god, look at that face you look like my next mistake love's a game, wanna play?"" ayy new money, suit and tie i can read you like a magazine ain't it funny? rumors fly and i know you heard about me so, hey, let's be friends i'm dyin' to see how this one ends grab your passport and my hand i can make the bad guys good for a weekend  cherry lips, crystal skies i could show you incredible things stolen kisses, pretty lies you're the king, baby, i'm your queen find out what you want be that girl for a month wait, the worst is yet to come, oh, no screaming, crying, perfect storms i can make all the tables turn rose garden filled with thorns keep you second guessin', like ""oh, my god, who is she?"" i get drunk on jealousy but you'll come back each time you leave 'cause, darling, i'm a nightmare dressed like a daydream   boys only want love if it's torture don't say i didn't, say i didn't warn ya boys only want love if it's torture don't say i didn't, say i didn't warn ya  [chorus] so it's gonna be forever or it's gonna go down in flames? you can tell me when it's over (over), mm if the high was worth the pain got a long list of ex-lovers they'll tell you i'm insane (i'm insane) 'cause you know i love the players and you love the game (love the game) 'cause we're young and we're reckless (yeah) we'll take this way too far (ooh) it'll leave you breathless, mm or with a nasty scar (or leave a nasty scar) got a long list of ex-lovers they'll tell you i'm insane but i've got a blank space, baby and i'll write your name",79
Uptown Funk (feat. Bruno Mars),Mark Ronson,"179 ContributorsTranslationsPortuguêsItalianoΕλληνικάDeutschUptown Funk Lyrics[Intro]
Doh
Doh-doh-doh, doh-doh-doh, doh-doh
Doh-doh-doh, doh-doh-doh, doh-doh
Doh-doh-doh, doh-doh-doh, doh-doh
Doh-doh-doh, doh-doh (Aw, ow)

[Verse 1]
This hit, that ice cold
Michelle Pfeiffer, that white gold
This one for them hood girls
Them good girls, straight masterpieces
Stylin', wilin', livin' it up in the city
Got Chucks on with Saint Laurent
Gotta kiss myself, I'm so pretty
[Refrain]
I'm too hot (Hot damn)
(Doh)
Uh, call the police and the fireman
(Doh-doh-doh, doh-doh-doh, doh-doh)
I'm too hot (Hot damn)
(Doh-doh-doh, doh-doh-doh, doh-doh)
Make a dragon wanna retire, man
I'm too hot (Hot damn)
(Doh-doh-doh, doh-doh-doh, doh-doh)
Say my name, you know who I am
I'm too hot (Hot damn)
(Doh-doh-doh, doh-doh, doh, doh)
And my band 'bout that money, break it down
You might also like[Pre-Chorus]
Girls hit your hallelujah (Woo)
Girls hit your hallelujah (Woo)
Girls hit your hallelujah (Woo)
'Cause uptown funk gon' give it to you (Woo)
('Cause uptown funk gon' give it to you)
'Cause uptown funk gon' give it to you
Saturday night and we in the spot
Don't believe me, just watch, come on

[Chorus]
Doh
Doh-doh-doh, doh-doh-doh, doh-doh (Ya)
(Doh-doh-doh, doh-doh-doh, doh-doh)
Don't believe me, just watch, uh
Doh-doh-doh, doh-doh-doh, doh-doh (Ya)
(Doh-doh-doh, doh-doh–)
Don't believe me, just watch, uh
Don't believe me, just watch, uh
Don't believe me, just watch
Don't believe me, just watch
Hey, hey, hey, oh

[Verse 2]
Stop, wait a minute
Fill my cup, put some liquor in it
Take a sip, sign the check
Julio, get the stretch
Ride to Harlem, Hollywood, Jackson, Mississippi
If we show up, we gon' show out
Smoother than a fresh jar o' Skippy
[Refrain]
I'm too hot (Hot damn)
(Doh)
Call the police and the fireman
(Doh-doh-doh, doh-doh-doh, doh-doh)
I'm too hot (Hot damn)
(Doh-doh-doh, doh-doh-doh, doh-doh)
Make a dragon wanna retire, man
I'm too hot (Too hot, hot damn, hot damn)
(Doh-doh-doh, doh-doh-doh, doh-doh)
Bitch, say my name, you know who I am
I'm too hot (Hot damn)
(Doh-doh-doh, doh-doh, doh, doh)
Uh, and my band 'bout that money, break it down

[Pre-Chorus]
Girls hit your hallelujah (Woo)
Girls hit your hallelujah (Woo)
Girls hit your hallelujah (Woo)
'Cause uptown funk gon' give it to you (Woo)
('Cause uptown funk gon' give it to you)
'Cause uptown funk gon' give it to you
Saturday night and we in the spot
Don't believe me, just watch, come on

[Chorus]
Doh
Doh-doh-doh, doh-doh-doh, doh-doh (Ya)
(Doh-doh-doh, doh-doh-doh, doh-doh)
Don't believe me, just watch, uh
Doh-doh-doh, doh-doh-doh, doh-doh (Ya)
(Doh-doh-doh, doh-doh–)
Don't believe me, just watch, uh
Don't believe me, just watch, uh
Don't believe me, just watch
Don't believe me, just watch
Hey, hey, hey, oh
[Bridge]
(Doh)
(Doh-doh-doh, doh-doh-doh, doh-doh)
Before we leave
(Doh-doh-doh, doh-doh-doh, doh-doh)
Lemme tell y'all a lil' something
Uptown funk you up, uptown funk you up
(Doh-doh-doh, doh-doh-doh, doh-doh)
Uptown funk you up, uptown funk you up, uh
(Doh-doh-doh, doh-doh-doh, doh-doh)
I said, uptown funk you up, uptown funk you up, uh
(Doh-doh-doh, doh-doh-doh, doh-doh)
Uptown funk you up, uptown funk you up, come on
(Doh-doh-doh, doh-doh, doh, doh)
Dance, jump on it
(Doh-doh-doh, doh-doh-doh, doh-doh)
If you sexy, then flaunt it
If you freaky, then own it
(Doh-doh-doh, doh-doh-doh, doh-doh)
Don't brag about it, come show me, come on
Dance, jump on it
(Doh-doh-doh, doh-doh-doh, doh-doh)
If you sexy, then flaunt it
Well, it's Saturday night and we in the spot
Don't believe me, just watch, come on

[Chorus]
Doh
Doh-doh-doh, doh-doh-doh, doh-doh (Ya)
(Doh-doh-doh, doh-doh-doh, doh-doh)
Don't believe me, just watch, uh
Doh-doh-doh, doh-doh-doh, doh-doh (Ya)
(Doh-doh-doh, doh-doh–)
Don't believe me, just watch, uh
Don't believe me, just watch, uh
Don't believe me, just watch
Don't believe me, just watch
Hey, hey, hey, oh

[Outro]
Uptown funk you up (Woo, come on)
(Doh)
Uptown funk you up (Hey, say what?)
(Doh-doh-doh, doh-doh-doh, doh-doh)
Uptown funk you up (Hey)
(Doh-doh-doh, doh)
Uptown funk you up (Come on)
(Doh)
Uptown funk you up (Woo, come on)
(Doh-doh-doh, doh-doh-doh, doh-doh)
Uptown funk you up (Hey, say what?)
Uptown funk you up (Hey)
Uptown funk you up (Come on)
(Doh)
Uptown funk you up (Woo, come on)
(Doh-doh-doh, doh-doh-doh, doh-doh)
Uptown funk you up (Hey, say what?)
Uptown funk you up (Hey)
(Doh-doh-doh, doh)
Uptown funk you up (Come on)
(Doh)
Uptown funk you up (Ah)
(Doh-doh-doh, doh-doh-doh, doh-doh)
Uptown funk you up (Say what?)
Uptown funk you up
Aw, ow554Embed","['Robert Wilson', 'Trinidad James', 'Rudy Taylor', 'Charlie Wilson', 'Ronnie Wilson', 'Lonnie Simmons', 'Devon Gallaspy', 'Bruno Mars', 'Mark Ronson', 'Philip Lawrence', 'Jeff Bhasker']","['Bruno Mars', 'Jeff Bhasker', 'Mark Ronson']",576123,0.856,0.609,0,-7.223,1,0.0824,0.00801,8.15e-05,0.0344,0.928,114.988,audio_features,32OlwWuMpZ6b0aN2RZOeMS,spotify:track:32OlwWuMpZ6b0aN2RZOeMS,https://api.spotify.com/v1/tracks/32OlwWuMpZ6b0aN2RZOeMS,https://api.spotify.com/v1/audio-analysis/32OlwWuMpZ6b0aN2RZOeMS,269667,4," doh doh-doh-doh, doh-doh-doh, doh-doh doh-doh-doh, doh-doh-doh, doh-doh doh-doh-doh, doh-doh-doh, doh-doh doh-doh-doh, doh-doh (aw, ow)   i'm too hot (hot damn) (doh) uh, call the police and the fireman (doh-doh-doh, doh-doh-doh, doh-doh) i'm too hot (hot damn) (doh-doh-doh, doh-doh-doh, doh-doh) make a dragon wanna retire, man i'm too hot (hot damn) (doh-doh-doh, doh-doh-doh, doh-doh) say my name, you know who i am i'm too hot (hot damn) (doh-doh-doh, doh-doh, doh, doh) and my band 'bout that money, break it down you might also like doh doh-doh-doh, doh-doh-doh, doh-doh (ya) (doh-doh-doh, doh-doh-doh, doh-doh) don't believe me, just watch, uh doh-doh-doh, doh-doh-doh, doh-doh (ya) (doh-doh-doh, doh-doh–) don't believe me, just watch, uh don't believe me, just watch, uh don't believe me, just watch don't believe me, just watch hey, hey, hey, oh   i'm too hot (hot damn) (doh) call the police and the fireman (doh-doh-doh, doh-doh-doh, doh-doh) i'm too hot (hot damn) (doh-doh-doh, doh-doh-doh, doh-doh) make a dragon wanna retire, man i'm too hot (too hot, hot damn, hot damn) (doh-doh-doh, doh-doh-doh, doh-doh) bitch, say my name, you know who i am i'm too hot (hot damn) (doh-doh-doh, doh-doh, doh, doh) uh, and my band 'bout that money, break it down   doh doh-doh-doh, doh-doh-doh, doh-doh (ya) (doh-doh-doh, doh-doh-doh, doh-doh) don't believe me, just watch, uh doh-doh-doh, doh-doh-doh, doh-doh (ya) (doh-doh-doh, doh-doh–) don't believe me, just watch, uh don't believe me, just watch, uh don't believe me, just watch don't believe me, just watch hey, hey, hey, oh  doh doh-doh-doh, doh-doh-doh, doh-doh (ya) (doh-doh-doh, doh-doh-doh, doh-doh) don't believe me, just watch, uh doh-doh-doh, doh-doh-doh, doh-doh (ya) (doh-doh-doh, doh-doh–) don't believe me, just watch, uh don't believe me, just watch, uh don't believe me, just watch don't believe me, just watch hey, hey, hey, oh  [outro] uptown funk you up (woo, come on) (doh) uptown funk you up (hey, say what?) (doh-doh-doh, doh-doh-doh, doh-doh) uptown funk you up (hey) (doh-doh-doh, doh) uptown funk you up (come on) (doh) uptown funk you up (woo, come on) (doh-doh-doh, doh-doh-doh, doh-doh) uptown funk you up (hey, say what?) uptown funk you up (hey) uptown funk you up (come on) (doh) uptown funk you up (woo, come on) (doh-doh-doh, doh-doh-doh, doh-doh) uptown funk you up (hey, say what?) uptown funk you up (hey) (doh-doh-doh, doh) uptown funk you up (come on) (doh) uptown funk you up (ah) (doh-doh-doh, doh-doh-doh, doh-doh) uptown funk you up (say what?) uptown funk you up aw, ow55",83
Thinking out Loud,Ed Sheeran,"194 ContributorsTranslationsTürkçeEspañolPortuguêsItalianoΕλληνικάFrançaisDeutschThinking Out Loud Lyrics[Verse 1]
When your legs don't work like they used to before
And I can't sweep you off of your feet
Will your mouth still remember the taste of my love?
Will your eyes still smile from your cheeks?
And darlin', I will be lovin' you till we're seventy
And baby, my heart could still fall as hard at twenty-three

[Pre-Chorus]
And I'm thinkin' 'bout how
People fall in love in mysterious ways
Maybe just the touch of a hand
Well, me, I fall in love with you every single day
And I just wanna tell you I am

[Chorus]
So honey, now, take me into your lovin' arms
Kiss me under the light of a thousand stars
And place your head on my beatin' heart, I'm thinkin' out loud
Maybe we found love right where we are

[Verse 2]
When my hair's all but gone and my memory fades
And the crowds don't remember my name
When my hands don't play the strings the same way, mmm
I know you will still love me the same
'Cause, honey, your soul could never grow old, it's evergreen
And baby, your smile's forever in my mind and memory
See Ed Sheeran LiveGet tickets as low as $48You might also like[Pre-Chorus]
I'm thinkin' 'bout how
People fall in love in mysterious ways
And maybe it's all part of a plan
Oh, I'll just keep on makin' the same mistakes
Hoping that you'll understand

[Chorus]
That, baby, now, take me into your lovin' arms
Kiss me under the light of a thousand stars
Place your head on my beatin' heart, I'm thinkin' out loud
And maybe we found love right where we are, oh-oh

[Bridge]
Lo-lo-lo, lo-lo-lo
Lo-lo-lo, lo-lo-lo, love

[Chorus]
So baby, now, take me into your lovin' arms
And kiss me under the light of a thousand stars, oh, darlin'
Place your head on my beatin' heart, I'm thinkin' out loud
That maybe we found love right where we are
Oh, maybe we found love right where we are
And we found love right where we are876Embed","['Ed Sheeran', 'Amy Wadge']",['Jake Gosling'],437103,0.781,0.445,2,-6.061,1,0.0295,0.474,0.0,0.184,0.591,78.998,audio_features,34gCuhDGsG4bRPIf9bb02f,spotify:track:34gCuhDGsG4bRPIf9bb02f,https://api.spotify.com/v1/tracks/34gCuhDGsG4bRPIf9bb02f,https://api.spotify.com/v1/audio-analysis/34gCuhDGsG4bRPIf9bb02f,281560,4," when your legs don't work like they used to before and i can't sweep you off of your feet will your mouth still remember the taste of my love? will your eyes still smile from your cheeks? and darlin', i will be lovin' you till we're seventy and baby, my heart could still fall as hard at twenty-three   so honey, now, take me into your lovin' arms kiss me under the light of a thousand stars and place your head on my beatin' heart, i'm thinkin' out loud maybe we found love right where we are   i'm thinkin' 'bout how people fall in love in mysterious ways and maybe it's all part of a plan oh, i'll just keep on makin' the same mistakes hoping that you'll understand   lo-lo-lo, lo-lo-lo lo-lo-lo, lo-lo-lo, love  [chorus] so baby, now, take me into your lovin' arms and kiss me under the light of a thousand stars, oh, darlin' place your head on my beatin' heart, i'm thinkin' out loud that maybe we found love right where we are oh, maybe we found love right where we are and we found love right where we are87",81
One Last Time,Ariana Grande,"137 ContributorsTranslationsEspañolPortuguêsFrançaisDeutschItalianoOne Last Time Lyrics[Verse 1]
I was a liar, I gave in to the fire
I know I should've fought it, at least I'm bein' honest
Feel like a failure 'cause I know that I failed you
I should've done you better 'cause you don't want a liar

[Pre-Chorus]
And I know, and I know, and I know she gives you everything
But, boy, I couldn't give it to you
And I know, and I know, and I know that you got everything
But I got nothin' here without you

[Chorus]
So, one last time
I need to be the one who takes you home
One more time
I promise after that, I'll let you go
Baby, I don't care if you got her in your heart
All I really care is you wake up in my arms
One last time
I need to be the one who takes you home

[Verse 2]
I don't deserve it, I know I don't deserve it
But stay with me a minute, I swear I'll make it worth it
Can't you forgive me? At least just temporarily
I know that this is my fault, I should've been more careful
You might also like[Pre-Chorus]
And I know, and I know, and I know she gives you everything
But, boy, I couldn't give it to you
And I know, and I know, and I know that you got everything
But I got nothin' here without you, baby

[Chorus]
So, one last time
I need to be the one who takes you home
One more time
I promise after that, I'll let you go
Baby, I don't care if you got her in your heart
All I really care is you wake up in my arms
One last time
I need to be the one who takes you home

[Bridge]
Yeah
I know I should've fought it, at least I'm bein' honest, hey
But stay with me a minute, I swear I'll make it worth it, babe
'Cause I don't wanna be without you (Oh)

[Chorus]
So, one last time
I need to be the one who takes you home (Takes you home, babe)
One more time
I promise after that, I'll let you go
Baby, I don't care if you got her in your heart, babe
All I really care is you wake up in my arms
One last time
I need to be the one who takes you home, yeah
[Outro]
One last time
I need to be the one who takes you home433Embed","['David Guetta', 'Rami', 'Carl Falk', 'Giorgio Tuinfort', 'Savan Kotecha']","['Savan Kotecha', 'Carl Falk', 'Rami']",500846,0.628,0.593,8,-5.036,1,0.0323,0.093,1.65e-06,0.096,0.104,125.025,audio_features,7xoUc6faLbCqZO6fQEYprd,spotify:track:7xoUc6faLbCqZO6fQEYprd,https://api.spotify.com/v1/tracks/7xoUc6faLbCqZO6fQEYprd,https://api.spotify.com/v1/audio-analysis/7xoUc6faLbCqZO6fQEYprd,197267,4," i was a liar, i gave in to the fire i know i should've fought it, at least i'm bein' honest feel like a failure 'cause i know that i failed you i should've done you better 'cause you don't want a liar   so, one last time i need to be the one who takes you home one more time i promise after that, i'll let you go baby, i don't care if you got her in your heart all i really care is you wake up in my arms one last time i need to be the one who takes you home   and i know, and i know, and i know she gives you everything but, boy, i couldn't give it to you and i know, and i know, and i know that you got everything but i got nothin' here without you, baby   yeah i know i should've fought it, at least i'm bein' honest, hey but stay with me a minute, i swear i'll make it worth it, babe 'cause i don't wanna be without you (oh)   one last time i need to be the one who takes you home4",82
See You Again (feat. Charlie Puth),Wiz Khalifa,"254 ContributorsTranslationsDeutschPortuguêsΕλληνικάFrançaisSee You Again Lyrics[Chorus: Charlie Puth]
It's been a long day
Without you, my friend
And I'll tell you all about it when I see you again
We've come a long way
From where we began
Oh, I'll tell you all about it when I see you again
When I see you again
[Verse 1: Wiz Khalifa]
Damn, who knew?
All the planes we flew, good things we been through
That I'd be standin' right here talkin' to you
'Bout another path, I know we loved to hit the road and laugh
But somethin' told me that it wouldn't last
Had to switch up, look at things different, see the bigger picture
Those were the days, hard work forever pays
Now I see you in a better place
Uh

[Refrain: Wiz Khalifa]
How can we not talk about family when family's all that we got?
Everything I went through, you were standin' there by my side
And now you gon' be with me for the last ride
[Chorus: Charlie Puth & Wiz Khalifa]
It's been a long day
Without you, my friend
And I'll tell you all about it when I see you again (I'll see you again)
We've come a long way (Yeah, we came a long way)
From where we began (You know where we started)
Oh, I'll tell you all about it when I see you again (Let me tell you)
When I see you again
See Wiz Khalifa LiveGet tickets as low as $60You might also like[Post-Chorus: Charlie Puth & Wiz Khalifa]
Oh, oh
Ooh (Yeah)
[Verse 2: Wiz Khalifa]
First, you both go out your way and the vibe is feelin' strong
And what's small turned to a friendship, a friendship turned to a bond
And that bond'll never be broken, the love will never get lost
And when brotherhood come first, then the line'll never be crossed
Established it on our own when that line had to be drawn
And that line is what we reached, so remember me when I'm gone

[Refrain: Wiz Khalifa]
How can we not talk about family when family's all that we got?
Everything I went through, you were standin' there by my side
And now you gon' be with me for the last ride

[Bridge: Charlie Puth]
So let the light guide your way, yeah
Hold every memory as you go
And every road you take
Will always lead you home, home
[Chorus: Charlie Puth]
It's been a long day
Without you, my friend
And I'll tell you all about it when I see you again
We've come a long way
From where we began
Oh, I'll tell you all about it when I see you again
When I see you again
[Post-Chorus: Charlie Puth & Wiz Khalifa]
Oh (Uh), oh (Yeah-yeah; yeah)
Ooh (Yo, yo, uh)
When I see you again (See you again, yeah, yeah)
Oh (Yeah), oh (Yeah, yeah; oh-oh)
Ooh (Uh-huh, yup)
When I see you again2.4KEmbed","['Dann Hume', 'Josh Hardy', 'Phoebe Lou', 'DJ Frank E', 'Andrew Cedar', 'Charlie Puth', 'Wiz Khalifa']","['Kevin Weaver', 'Mike Caren', 'Andrew Cedar', 'Charlie Puth', 'DJ Frank E']",720401,0.689,0.481,10,-7.503,1,0.0815,0.369,1.03e-06,0.0649,0.283,80.025,audio_features,2JzZzZUQj3Qff7wapcbKjc,spotify:track:2JzZzZUQj3Qff7wapcbKjc,https://api.spotify.com/v1/tracks/2JzZzZUQj3Qff7wapcbKjc,https://api.spotify.com/v1/audio-analysis/2JzZzZUQj3Qff7wapcbKjc,229526,4," it's been a long day without you, my friend and i'll tell you all about it when i see you again we've come a long way from where we began oh, i'll tell you all about it when i see you again when i see you again  how can we not talk about family when family's all that we got? everything i went through, you were standin' there by my side and now you gon' be with me for the last ride  oh, oh ooh (yeah)  how can we not talk about family when family's all that we got? everything i went through, you were standin' there by my side and now you gon' be with me for the last ride   it's been a long day without you, my friend and i'll tell you all about it when i see you again we've come a long way from where we began oh, i'll tell you all about it when i see you again when i see you again  oh (uh), oh (yeah-yeah; yeah) ooh (yo, yo, uh) when i see you again (see you again, yeah, yeah) oh (yeah), oh (yeah, yeah; oh-oh) ooh (uh-huh, yup) when i see you again2.4k",81
