Track Name,Artist Name,Lyrics,Writers,Producers,Genius_ID,danceability,energy,key,loudness,mode,speechiness,acousticness,instrumentalness,liveness,valence,tempo,type,id,uri,track_href,analysis_url,duration_ms,time_signature,clean_lyrics,Popularity
Style,Taylor Swift,"173 ContributorsTranslationsTürkçeFrançaisEspañolPortuguêsPolskiDeutschУкраїнськаStyle Lyrics[Verse 1]
Midnight
You come and pick me up, no headlights
A long drive
Could end in burning flames or paradise
Fade into view, oh
It's been a while since I have even heard from you
(Heard from you)

[Pre-Chorus]
And I should just tell you to leave, 'cause I
Know exactly where it leads, but I
Watch us go 'round and 'round each time

[Chorus]
You got that James Dean daydream look in your eye
And I got that red lip classic thing that you like
And when we go crashing down, we come back every time
'Cause we never go out of style, we never go out of style
You got that long hair, slicked back, white T-shirt
And I got that good girl faith and a tight little skirt
And when we go crashing down, we come back every time
'Cause we never go out of style, we never go out of style

[Verse 2]
So it goes
He can't keep his wild eyes on the road, mmm
Takes me home
The lights are off, he's taking off his coat, mmm, yeah
I say, ""I heard, oh
That you've been out and about with some other girl""
Some other girl
See Taylor Swift LiveGet tickets as low as $446You might also like[Pre-Chorus]
He says, ""What you heard is true, but I
Can't stop thinking 'bout you and I""
I said, ""I've been there too a few times""

[Chorus]
'Cause you got that James Dean daydream look in your eye
And I got that red lip classic thing that you like
And when we go crashing down, we come back every time
'Cause we never go out of style, we never go out of style
You got that long hair, slicked back, white T-shirt
And I got that good girl faith and a tight little skirt (A tight little skirt)
And when we go crashing down, we come back every time
'Cause we never go out of style (We never go, we never go), we never go out of style

[Bridge]
Take me home (Ah)
Just take me home (Ah)
Yeah, just take me home (Ah)
Oh-oh, woah-oh, oh (Out of style)

[Chorus]
Oh, you got that James Dean daydream look in your eye
And I got that red lip classic thing that you like
And when we go crashing down (And when we go), we come back every time
'Cause we never go out of style, we never go out of style1KEmbed","['Ali Payami', 'Shellback', 'Max Martin', 'Taylor Swift']","['Ali Payami', 'Shellback', 'Max Martin']",542390,0.588,0.791,7,-5.595,1,0.0402,0.00245,0.00258,0.118,0.487,94.933,audio_features,0ug5NqcwcFR2xrfTkc7k8e,spotify:track:0ug5NqcwcFR2xrfTkc7k8e,https://api.spotify.com/v1/tracks/0ug5NqcwcFR2xrfTkc7k8e,https://api.spotify.com/v1/audio-analysis/0ug5NqcwcFR2xrfTkc7k8e,231000,4," midnight you come and pick me up, no headlights a long drive could end in burning flames or paradise fade into view, oh it's been a while since i have even heard from you (heard from you)   you got that james dean daydream look in your eye and i got that red lip classic thing that you like and when we go crashing down, we come back every time 'cause we never go out of style, we never go out of style you got that long hair, slicked back, white t-shirt and i got that good girl faith and a tight little skirt and when we go crashing down, we come back every time 'cause we never go out of style, we never go out of style   he says, ""what you heard is true, but i can't stop thinking 'bout you and i"" i said, ""i've been there too a few times""   take me home (ah) just take me home (ah) yeah, just take me home (ah) oh-oh, woah-oh, oh (out of style)  [chorus] oh, you got that james dean daydream look in your eye and i got that red lip classic thing that you like and when we go crashing down (and when we go), we come back every time 'cause we never go out of style, we never go out of style1k",78
Runaway (U & I),Galantis,"65 ContributorsRunaway (U & I) Lyrics[Verse 1: Cathy Dennis]
Think I can fly, think I can fly when I'm with you
My arms are wide, catching fire as the wind blows
I know that I'm rich enough for pride, I see a billion dollars in your eyes
Even if we’re strangers 'til we die

[Chorus: Julia Karlsson]
I wanna run away
I wanna run away
Anywhere out this place
I wanna run away
Just you and I, I, I, I, I
You and I, I, I, I, I
You and I, I, I, I, I
You and I, I, I, I, I
Just you and I

[Post-Chorus]
You and I, I, I, I, I
You and I, I, I, I, I
You and I, I, I, I, I
You and I, I, I, I, I
Oh
(You)
(You)
(You)
(You)
You might also like[Verse 2: Cathy Dennis]
I wanna run, chase the moon and sun when I'm with you
Give it all away, catching fire as the wind blows
I know that I'm rich enough for pride, I see a billion dollars in your eyes
Even if we’re strangers 'til we die

[Chorus: Julia Karlsson]
I wanna run away
I wanna run away
Anywhere out this place
I wanna run away
Just you and I, I, I, I, I
You and I, I, I, I, I
You and I, I, I, I, I
You and I, I, I, I, I
Just you and I

[Post-Chorus]
You and-
I, I, I
Just you and I, I, I, I, I
You and I, I, I, I, I
You and I, I, I, I, I
You and I, I, I, I, I
Just you and I
You and-
I, I, I
Oh
(You)
(You)
(You)62Embed","['Svidden', 'Style Of Eye', 'Anton Rundberg', 'Cathy Dennis', 'Julia Karlsson', 'Bloodshy']","['Style Of Eye', 'Bloodshy']",530786,0.506,0.805,1,-4.119,1,0.0469,0.00711,0.00193,0.0856,0.383,126.008,audio_features,46lFttIf5hnUZMGvjK0Wxo,spotify:track:46lFttIf5hnUZMGvjK0Wxo,https://api.spotify.com/v1/tracks/46lFttIf5hnUZMGvjK0Wxo,https://api.spotify.com/v1/audio-analysis/46lFttIf5hnUZMGvjK0Wxo,227074,4," think i can fly, think i can fly when i'm with you my arms are wide, catching fire as the wind blows i know that i'm rich enough for pride, i see a billion dollars in your eyes even if we're strangers 'til we die   you and i, i, i, i, i you and i, i, i, i, i you and i, i, i, i, i you and i, i, i, i, i oh (you) (you) (you) (you) you might also like i wanna run away i wanna run away anywhere out this place i wanna run away just you and i, i, i, i, i you and i, i, i, i, i you and i, i, i, i, i you and i, i, i, i, i just you and i   you and- i, i, i just you and i, i, i, i, i you and i, i, i, i, i you and i, i, i, i, i you and i, i, i, i, i just you and i you and- i, i, i oh (you) (you) (you)6",75
Time of Our Lives,Pitbull,"62 ContributorsTime of Our Lives Lyrics[Pre-Chorus: Ne-Yo]
I knew my rent was gon' be late about a week ago (Hey)
I worked my ass off, but I still can't pay it though (Woo)
But I got just enough to get off in this club
Have me a good time, before my time is up
Hey, let's get it now

[Chorus: Ne-Yo]
Ooh, I want the time of my life, yeah (Mr. Worldwide), oh, baby
Ooh, give me the time of my life (Ne-yo), hey, hey, hey
Let's get it now

[Verse 1: Pitbull]
This the last twenty dollars I got
But I'ma have a good time ballin' tonight
Tell the bartender, ""Line up some shots""
'Cause I'ma get loose tonight
She's on fire, she's so hot
I'm no liar, she burned up the spot
Look like Mariah, I took another shot
And told her drop, drop, drop, drop it like it's hot
Dirty talk (Hey), dirty dance (Hey)
She a freaky girl (Hey) and I'm a freaky man (Hey)
She on the rebound, broke up with her ex
And I'm like Rodman, ready on deck
I told her, ""Wanna ride out?"" And she said, ""Yes""
We didn't go to church but I got blessed
You might also like[Pre-Chorus: Ne-Yo]
I knew my rent was gon' be late about a week ago
I worked my ass off, but I still can't pay it though
But I got just enough to get off in this club
Have me a good time, before my time is up
Hey, let's get it now

[Chorus: Ne-Yo]
Ooh, I want the time of my life, yeah, oh, baby
Ooh, give me the time of my life, hey, hey, hey
Let's get it now

[Verse 2: Pitbull]
Tonight, I'ma lose my mind
Better get yours 'cause I'm gon' get mine
Party every night like my last
Mami know the drill, shake that ass
Go ahead, baby, let me see what you got
You know you got the biggest booty in this spot
And I just wanna see that thing drop
From the back, to the front, to the top
You know me, I'm off in the cut
Always like a squirrel lookin' for a nut
This is a fo' sho, I'm not talkin' 'bout luck
I'm not talkin' 'bout love, I'm talkin' 'bout lust
Now let's get loose, have some fun
Forget about bills and the first of the month
It's my night, your night, our night, let's turn it up
[Pre-Chorus: Ne-Yo]
I knew my rent was gon' be late about a week ago
I worked my ass off, but I still can't pay it though
But I got just enough to get off in this club
Have me a good time, before my time is up
Hey, let's get it now

[Chorus: Ne-Yo]
Ooh, I want the time of my life, yeah, oh, baby
Ooh, give me the time of my life, hey, hey, hey
Let's get it now

[Bridge: Ne-Yo]
Everybody goin' through something
(Everybody goin' through something)
I said, everybody goin' through something
(Everybody goin' through something)
So you might as well roll it up
Pour it up, drink it up, throw it up tonight
I said, everybody goin' through something
(Everybody goin' through something)
Ayy, said, everybody goin' through something
(Everybody goin' through something)
So you might as well roll it up
Pour it up, drink it up, throw it up tonight, oh, yeah, yeah
[Interlude: Pitbull]
This for everybody going through tough times
Believe me, been there, done that
But every day above ground is a great day, remember that
Dale

[Pre-Chorus: Ne-Yo]
I knew my rent was gon' be late about a week ago
I worked my ass off, but I still can't pay it though
But I got just enough to get off in this club
Have me a good time, before my time is up
Hey, let's get it now

[Chorus: Ne-Yo]
Ooh, I want the time of my life, yeah, oh, baby
Ooh, give me the time of my life, hey, hey, hey
Let's get it now49Embed","['Lifted', 'Cirkut', 'Robin Weisse', 'Pitbull', 'Ne-Yo', 'Dr. Luke', 'Al Burna']","['Cirkut', 'Lifted', 'Dr. Luke']",579177,0.721,0.802,1,-5.797,1,0.0583,0.0921,0.0,0.694,0.724,124.022,audio_features,2bJvI42r8EF3wxjOuDav4r,spotify:track:2bJvI42r8EF3wxjOuDav4r,https://api.spotify.com/v1/tracks/2bJvI42r8EF3wxjOuDav4r,https://api.spotify.com/v1/audio-analysis/2bJvI42r8EF3wxjOuDav4r,229360,4," i knew my rent was gon' be late about a week ago (hey) i worked my ass off, but i still can't pay it though (woo) but i got just enough to get off in this club have me a good time, before my time is up hey, let's get it now   this the last twenty dollars i got but i'ma have a good time ballin' tonight tell the bartender, ""line up some shots"" 'cause i'ma get loose tonight she's on fire, she's so hot i'm no liar, she burned up the spot look like mariah, i took another shot and told her drop, drop, drop, drop it like it's hot dirty talk (hey), dirty dance (hey) she a freaky girl (hey) and i'm a freaky man (hey) she on the rebound, broke up with her ex and i'm like rodman, ready on deck i told her, ""wanna ride out?"" and she said, ""yes"" we didn't go to church but i got blessed you might also like ooh, i want the time of my life, yeah, oh, baby ooh, give me the time of my life, hey, hey, hey let's get it now   i knew my rent was gon' be late about a week ago i worked my ass off, but i still can't pay it though but i got just enough to get off in this club have me a good time, before my time is up hey, let's get it now   everybody goin' through something (everybody goin' through something) i said, everybody goin' through something (everybody goin' through something) so you might as well roll it up pour it up, drink it up, throw it up tonight i said, everybody goin' through something (everybody goin' through something) ayy, said, everybody goin' through something (everybody goin' through something) so you might as well roll it up pour it up, drink it up, throw it up tonight, oh, yeah, yeah  i knew my rent was gon' be late about a week ago i worked my ass off, but i still can't pay it though but i got just enough to get off in this club have me a good time, before my time is up hey, let's get it now   ooh, i want the time of my life, yeah, oh, baby ooh, give me the time of my life, hey, hey, hey let's get it now4",84
The Less I Know The Better,Tame Impala,"166 ContributorsTranslationsFrançaisTürkçeEspañolPortuguêsItalianoDeutschThe Less I Know the Better Lyrics[Verse 1]
Someone said they left together
I ran out the door to get her
She was holding hands with Trevor
Not the greatest feeling ever
Said, ""Pull yourself together
You should try your luck with Heather""
Then I heard they slept together
Oh, the less I know the better
The less I know the better

[Chorus]
Oh, my love, can't you see yourself by my side?
No surprise, leanin' on his shoulder like every night
Oh, my love, can't you see that you're on my mind?
Don't suppose you could convince your lover to change his mind
So goodbye

[Verse 2]
She said, ""It's not now or never
Wait ten years, we'll be together""
I said, ""Better late than never
Just don't make me wait forever""
Don't make me wait forever
Don't make me wait forever
You might also like[Chorus]
Oh, my love, can't you see yourself by my side?
I don't suppose you could convince your lover to change his mind

[Verse 3]
I was doing fine without ya
'Til I saw your face, now I can't erase
Givin' in to all his bullshit
Is this what you want? Is this who you are?
I was doing fine without ya
'Til I saw your eyes turn away from mine
All sweet talkin', where he wants ya

[Outro]
So, come on, Superman, say your stupid line
So, come on, Superman, say your stupid line
So, come on, Superman, say your stupid line206Embed",['Kevin Parker'],['Kevin Parker'],2165830,0.64,0.74,4,-4.083,1,0.0284,0.0115,0.00678,0.167,0.785,116.879,audio_features,6K4t31amVTZDgR3sKmwUJJ,spotify:track:6K4t31amVTZDgR3sKmwUJJ,https://api.spotify.com/v1/tracks/6K4t31amVTZDgR3sKmwUJJ,https://api.spotify.com/v1/audio-analysis/6K4t31amVTZDgR3sKmwUJJ,216320,4," someone said they left together i ran out the door to get her she was holding hands with trevor not the greatest feeling ever said, ""pull yourself together you should try your luck with heather"" then i heard they slept together oh, the less i know the better the less i know the better   she said, ""it's not now or never wait ten years, we'll be together"" i said, ""better late than never just don't make me wait forever"" don't make me wait forever don't make me wait forever you might also like i was doing fine without ya 'til i saw your face, now i can't erase givin' in to all his bullshit is this what you want? is this who you are? i was doing fine without ya 'til i saw your eyes turn away from mine all sweet talkin', where he wants ya  [outro] so, come on, superman, say your stupid line so, come on, superman, say your stupid line so, come on, superman, say your stupid line20",85
Cool for the Summer,Demi Lovato,"95 ContributorsTranslationsTiếng ViệtPortuguêsEspañolCool For The Summer Lyrics[Verse 1]
Tell me what you want, what you like, it's okay
I'm a little curious, too
Tell me if it's wrong, if it's right, I don't care
I can keep a secret, can you?

[Refrain]
Got my mind on your body
And your body on my mind
Got a taste for the cherry
I just need to take a bite

[Pre-Chorus]
Don't tell your mother
Kiss one another
Die for each other
We're cool for the summer (Ha!)

[Break]
Ooh
Ooh

[Chorus]
Take me down into your paradise
Don't be scared, 'cause I'm your body type
Just something that we wanna try
'Cause you and I
We're cool for the summer
You might also like[Verse 2]
Tell me if I won, if I did, what's my prize?
I just wanna play with you, too
Even if they judge, fuck it, I'll do the time
I just wanna have some fun with you

[Refrain]
Got my mind on your body
And your body on my mind
Got a taste for the cherry
I just need to take a bite

[Pre-Chorus]
Don't tell your mother
Kiss one another
Die for each other
We're cool for the summer (Ha!)

[Break]
Ooh
Ooh

[Chorus]
Take me down into your paradise
Don't be scared, 'cause I'm your body type
Just something that we wanna try
'Cause you and I (You and I)
We're cool for the summer (Ha!)
We're cool for the summer
We're cool for the summer
[Interlude]
Shhh, don't tell your mother

[Bridge]
Got my mind on your body
And your body on my mind
Got a taste for the cherry
I just need to take a bite
Take me down

[Chorus]
Take me down into your paradise (Don't be scared)
Don't be scared, 'cause I'm your body type
Just something that we wanna try (Wanna try)
'Cause you and I (You and I)
We're cool for the summer (Oh)

[Post-Chorus]
(Take me down)
We're cool for the summer
(Don't be scared)
'Cause I'm your body type
(Just something)
Just something that we wanna try
'Cause you and I (You and I)
We're cool for the summer (Ha!)
[Outro]
(Ooh)
We're cool for the summer207Embed","['Ali Payami', 'Alexander Kronlund', 'Savan Kotecha', 'Max Martin', 'Demi Lovato']","['Max Martin', 'Ali Payami']",2158461,0.583,0.61,5,-5.639,0,0.0382,0.00425,0.000105,0.14,0.336,114.06,audio_features,3uwnnTQcHM1rDqSfA4gQNz,spotify:track:3uwnnTQcHM1rDqSfA4gQNz,https://api.spotify.com/v1/tracks/3uwnnTQcHM1rDqSfA4gQNz,https://api.spotify.com/v1/audio-analysis/3uwnnTQcHM1rDqSfA4gQNz,214740,4," tell me what you want, what you like, it's okay i'm a little curious, too tell me if it's wrong, if it's right, i don't care i can keep a secret, can you?   don't tell your mother kiss one another die for each other we're cool for the summer (ha!)   take me down into your paradise don't be scared, 'cause i'm your body type just something that we wanna try 'cause you and i we're cool for the summer you might also like got my mind on your body and your body on my mind got a taste for the cherry i just need to take a bite   ooh ooh   shhh, don't tell your mother   take me down into your paradise (don't be scared) don't be scared, 'cause i'm your body type just something that we wanna try (wanna try) 'cause you and i (you and i) we're cool for the summer (oh)   (ooh) we're cool for the summer20",76
Hold My Hand,Jess Glynne,"39 ContributorsHold My Hand Lyrics[Verse 1]
Standing in a crowded room, and I can't see your face
(Ooh, ooh-ooh-ooh, ooh-ooh, ooh-ooh-ooh, ooh-ooh)
Put your arms around me, tell me everything's OK
(Ooh, ooh-ooh-ooh, ooh-ooh, ooh-ooh-ooh, ooh-ooh)
In my mind, I'm running 'round a cold and empty space
(Ooh, ooh-ooh-ooh, ooh-ooh, ooh-ooh-ooh, ooh-ooh)
Just put your arms around me, tell me everything's OK
(Ooh, ooh-ooh-ooh, ooh-ooh, ooh-ooh-ooh, ooh-ooh)

[Pre-Chorus]
Break my bones, but you won't see me fall, oh
The rising tide will rise against them all, oh

[Chorus]
Darling, hold my hand
Oh, won't you hold my hand?
'Cause I don't wanna walk on my own anymore
Won't you understand?
Cause I don't wanna walk alone
I'm ready for this, there's no denying
I'm ready for this, you stop me falling
I'm ready for this, I need you all in
I'm ready for this, so darling, hold my hand

[Verse 2]
Soul is like a melting pot when you're not next to me
(Ooh, ooh-ooh-ooh, ooh-ooh, ooh-ooh-ooh, ooh-ooh)
Tell me that you've got me and you're never gonna leave
(Ooh, ooh-ooh-ooh, ooh-ooh, ooh-ooh-ooh, ooh-ooh)
Tryna find a moment where I can find release (Find release)
(Ooh, ooh-ooh-ooh, ooh-ooh, ooh-ooh-ooh, ooh-ooh)
Please tell me that you've got me and you're never gonna leave
(Leave, ooh, ooh-ooh-ooh, ooh-ooh, ooh-ooh-ooh, ooh-ooh)
See Jess Glynne LiveGet tickets as low as $36You might also like[Pre-Chorus]
Break my bones, but you won't see me fall, oh
The rising tide will rise against them all, oh

[Chorus]
Darling, hold my hand (Ah-ah, ah-ah)
Oh, won't you hold my hand? (Ah-ah, ah-ah)
Cause I don't wanna walk on my own anymore
Won't you understand? (Ah-ah)
'Cause I don't wanna walk alone
I'm ready for this, there's no denying
I'm ready for this, you stop me falling
I'm ready for this, I need you all in
I'm ready for this, so darling, hold my hand

[Bridge]
Don't wanna know
That feeling when I'm all alone
So please don't make me wait, cause I don't wanna break
No, I don't wanna fall
When you're next to me
Can tell I'm not afraid to be
That you don't make me wait, and never let me break
You never let me fall

[Chorus]
Darling, hold my hand (Ah-ah, ah-ah)
Oh, won't you hold my hand? (Ah-ah, ah-ah)
Cause I don't wanna walk on my own anymore
Won't you understand? (Ah-ah)
'Cause I don't wanna walk alone
I'm ready for this, there's no denying
I'm ready for this, you stop me falling
I'm ready for this, I need you all in
I'm ready for this, so darling, hold my hand141Embed","['Jess Glynne', 'Jin Jin', 'Jack Patterson', 'Ina Wroldsen']",['Starsmith'],688579,0.642,0.823,0,-5.717,1,0.0289,0.00159,0.0,0.0776,0.431,122.977,audio_features,1i1rNVtxbE7rdFfpHuNq2j,spotify:track:1i1rNVtxbE7rdFfpHuNq2j,https://api.spotify.com/v1/tracks/1i1rNVtxbE7rdFfpHuNq2j,https://api.spotify.com/v1/audio-analysis/1i1rNVtxbE7rdFfpHuNq2j,227344,4," standing in a crowded room, and i can't see your face (ooh, ooh-ooh-ooh, ooh-ooh, ooh-ooh-ooh, ooh-ooh) put your arms around me, tell me everything's ok (ooh, ooh-ooh-ooh, ooh-ooh, ooh-ooh-ooh, ooh-ooh) in my mind, i'm running 'round a cold and empty space (ooh, ooh-ooh-ooh, ooh-ooh, ooh-ooh-ooh, ooh-ooh) just put your arms around me, tell me everything's ok (ooh, ooh-ooh-ooh, ooh-ooh, ooh-ooh-ooh, ooh-ooh)   darling, hold my hand oh, won't you hold my hand? 'cause i don't wanna walk on my own anymore won't you understand? cause i don't wanna walk alone i'm ready for this, there's no denying i'm ready for this, you stop me falling i'm ready for this, i need you all in i'm ready for this, so darling, hold my hand   break my bones, but you won't see me fall, oh the rising tide will rise against them all, oh   don't wanna know that feeling when i'm all alone so please don't make me wait, cause i don't wanna break no, i don't wanna fall when you're next to me can tell i'm not afraid to be that you don't make me wait, and never let me break you never let me fall  [chorus] darling, hold my hand (ah-ah, ah-ah) oh, won't you hold my hand? (ah-ah, ah-ah) cause i don't wanna walk on my own anymore won't you understand? (ah-ah) 'cause i don't wanna walk alone i'm ready for this, there's no denying i'm ready for this, you stop me falling i'm ready for this, i need you all in i'm ready for this, so darling, hold my hand4",59
Geronimo,Sheppard,"48 ContributorsGeronimo Lyrics[Verse 1]
Can you feel it? Now it's comin' back
We can steal it if we bridge this gap
I can see ya through the curtains of the waterfall
When I lost it, yeah, you held my hand
But I tossed it, didn't understand
You were waitin' as I dove into the waterfall

[Chorus]
So, say Geronimo, say Geronimo
Say Geronimo, say Geronimo
Say Geronimo, say Geronimo
Say Geronimo

[Post-Chorus]
Can you feel my love?
Bombs away, bombs away
Bombs away
Can you feel my love? (My love, my love, my love, my love)
Bombs away, bombs away
Bombs away
Say Geronimo

[Verse 2]
Well, we rushed it, movin' way too fast
That we crushed it, but it's in the past
We can make this leap through the curtains of the waterfall
See Sheppard LiveGet tickets as low as $22You might also like[Chorus]
So, say Geronimo, say Geronimo
Say Geronimo, say Geronimo
Say Geronimo, say Geronimo
Say Geronimo

[Post-Chorus]
Can you feel my love? (My love, my love, my love, my love)
Bombs away, bombs away
Bombs away
Can you feel my love? (My love, my love, my love, my love)
Bombs away, bombs away
Bombs away

[Bridge]
Well, I'm just a boy with a broken toy
All lost and coy at the curtains of the waterfall
So it's here I stand as a broken man
But I've found my friend at the curtains of the waterfall
Now I'm falling down through the crashing sound
And you've come around at the curtains of the waterfall
And you rush to me and it sets us free
So I fall to my knees at the curtains of the waterfall

[Chorus]
So, say Geronimo, say Geronimo
Say Geronimo, say Geronimo
Say Geronimo, say Geronimo
Say Geronimo, say Geronimo
[Post-Chorus]
Can you feel my love?
(Say Geronimo, say Geronimo)
(Say Geronimo, say Geronimo)
Bombs away, bombs away
(Say Geronimo, say Geronimo)
Bombs away
(Say Geronimo, say Geronimo)

[Outro]
Can you feel my love?
(Make this leap)
(Make this leap)
(Make this leap, ooh)
(Make this leap, ooh)
Can you feel my love?39Embed","['Amy Sheppard', 'George Sheppard', 'Jason Bovino']",['Stuart Stuart'],468605,0.706,0.78,7,-6.267,1,0.0795,0.451,0.00141,0.115,0.451,142.029,audio_features,0qt5f5EL92o8Snzopsv0en,spotify:track:0qt5f5EL92o8Snzopsv0en,https://api.spotify.com/v1/tracks/0qt5f5EL92o8Snzopsv0en,https://api.spotify.com/v1/audio-analysis/0qt5f5EL92o8Snzopsv0en,218228,4," can you feel it? now it's comin' back we can steal it if we bridge this gap i can see ya through the curtains of the waterfall when i lost it, yeah, you held my hand but i tossed it, didn't understand you were waitin' as i dove into the waterfall   can you feel my love? bombs away, bombs away bombs away can you feel my love? (my love, my love, my love, my love) bombs away, bombs away bombs away say geronimo   so, say geronimo, say geronimo say geronimo, say geronimo say geronimo, say geronimo say geronimo   well, i'm just a boy with a broken toy all lost and coy at the curtains of the waterfall so it's here i stand as a broken man but i've found my friend at the curtains of the waterfall now i'm falling down through the crashing sound and you've come around at the curtains of the waterfall and you rush to me and it sets us free so i fall to my knees at the curtains of the waterfall   can you feel my love? (say geronimo, say geronimo) (say geronimo, say geronimo) bombs away, bombs away (say geronimo, say geronimo) bombs away (say geronimo, say geronimo)  [outro] can you feel my love? (make this leap) (make this leap) (make this leap, ooh) (make this leap, ooh) can you feel my love?3",72
