Track Name,Artist Name,Lyrics,Writers,Producers,Genius_ID,danceability,energy,key,loudness,mode,speechiness,acousticness,instrumentalness,liveness,valence,tempo,type,id,uri,track_href,analysis_url,duration_ms,time_signature,clean_lyrics,Popularity
Marvin Gaye (feat. Meghan Trainor),Charlie Puth,"62 ContributorsMarvin Gaye Lyrics[Chorus: Charlie Puth]
Let's Marvin Gaye and get it on
You got the healing that I want
Just like they say it in the song
Until the dawn, let's Marvin Gaye and get it on

[Verse 1: Charlie Puth]
We got this king-size to ourselves
Don't have to share with no one else
Don't keep your secrets to yourself
It's Kama Sutra show and tell, yeah

[Refrain: Charlie Puth]
Whoa-oh-oh-oh
There's lovin' in your eyes that pulls me closer
(Oh, it pulls me closer)
It's so subtle (It's so subtle)
I'm in trouble (I'm in trouble)
But I'd love to be in trouble with you
[Chorus: Charlie Puth & Meghan Trainor, Charlie Puth]
Let's Marvin Gaye and get it on
You got the healin' that I want
Just like they say it in the song
Until the dawn, let's Marvin Gaye and get it on
You've got to give it up to me
I'm screaming, ""Mercy, mercy, please!""
Just like they say it in the song
Until the dawn, let's Marvin Gaye and get it on
See Charlie Puth LiveGet tickets as low as $48You might also like[Verse 2: Meghan Trainor]
And when you leave me all alone
I'm like a stray without a home
I'm like a dog without a bone
I just want you for my own
I got to have you, babe

[Refrain: Charlie Puth & Meghan Trainor]
Whoa-oh-oh-oh
There's lovin' in your eyes that pulls me closer
(Oh, it pulls me closer)
It's so subtle (It's so subtle)
I'm in trouble (I'm in trouble)
But I'd rather be in trouble with you
[Bridge: Charlie Puth, Meghan Trainor]
Let's Marvin Gaye and get it on
Ooh, baby, got that healing that you want, yeah
Like they say it in the songs
Until the dawn, let's Marvin Gaye and get it on

[Chorus: Charlie Puth & Meghan Trainor]
Let's Marvin Gaye and get it on
You got the healin' that I want
Just like they say it in the song
Until the dawn, let's Marvin Gaye and get it on, babe
You've got to give it up to me
I'm screaming, ""Mercy, mercy, please!""
Just like they say it in the song
Until the dawn, let's Marvin Gaye and get it on
[Outro: Charlie Puth & Meghan Trainor]
Just like they say it in the song
Until the dawn, let's Marvin Gaye and get it on, ooh51Embed","['Nick Seeley', 'Jacob Luttrell', 'Charlie Puth', 'Julie Frost']","['Charlie Puth', 'Producer Nick Productions']",706298,0.795,0.616,1,-5.281,0,0.06,0.417,0.0,0.349,0.815,110.015,audio_features,3rKYiySCDMUKTw5kGVVhaa,spotify:track:3rKYiySCDMUKTw5kGVVhaa,https://api.spotify.com/v1/tracks/3rKYiySCDMUKTw5kGVVhaa,https://api.spotify.com/v1/audio-analysis/3rKYiySCDMUKTw5kGVVhaa,190453,4," let's marvin gaye and get it on you got the healing that i want just like they say it in the song until the dawn, let's marvin gaye and get it on   whoa-oh-oh-oh there's lovin' in your eyes that pulls me closer (oh, it pulls me closer) it's so subtle (it's so subtle) i'm in trouble (i'm in trouble) but i'd love to be in trouble with you  and when you leave me all alone i'm like a stray without a home i'm like a dog without a bone i just want you for my own i got to have you, babe   let's marvin gaye and get it on ooh, baby, got that healing that you want, yeah like they say it in the songs until the dawn, let's marvin gaye and get it on   just like they say it in the song until the dawn, let's marvin gaye and get it on, ooh5",64
Let It Go,James Bay,"100 ContributorsTranslationsPortuguêsLet It Go Lyrics[Verse 1]
From walking home and talking loads
To seeing shows in evening clothes with you
From nervous touch and getting drunk
To staying up and waking up with you

[Pre-Chorus]
Now we're slipping near the edge
Holding something we don't need
All this delusion in our heads
Is gonna bring us to our knees

[Chorus]
So, come on, let it go, just let it be
Why don't you be you, and I'll be me?
Everything that's broke, leave it to the breeze
Why don't you be you, and I'll be me?
And I'll be me

[Verse 2]
From throwing clothes across the floor
To teeth and claws and slamming doors at you
If this is all we're living for
Why are we doing it, doing it, doing it anymore?

[Pre-Chorus]
I used to recognize myself
It's funny how reflections change
When we're becoming something else
I think it's time to walk away
See James Bay LiveGet tickets as low as $65You might also like[Chorus]
So, come on, let it go, just let it be
Why don't you be you, and I'll be me?
Everything that's broke, leave it to the breeze
Why don't you be you, and I'll be me?
And I'll be me

[Bridge]
Tryna fit your hand inside of mine
When we know it just don't belong
'Cause no force on earth could make it feel right, no, no
Tryna push this problem up the hill
When it's just too heavy to hold
I think now's the time to let it slide

[Breakdown]
So, come on, let it go, just let it be
Why don't you be you, and I'll be me?
Everything that's broke, leave it to the breeze
Let the ashes fall, forget about me

[Outro]
Come on, let it go, just let it be
Why don't you be you, and I'll be me?
And I'll be me
(Ooh, me, you)161Embed","['James Bay', 'Paul Barry']",['Jacquire King'],510898,0.536,0.311,1,-10.396,1,0.0288,0.82,1.65e-05,0.107,0.246,147.486,audio_features,3nnG7AM9QopHVPEuLX3Khk,spotify:track:3nnG7AM9QopHVPEuLX3Khk,https://api.spotify.com/v1/tracks/3nnG7AM9QopHVPEuLX3Khk,https://api.spotify.com/v1/audio-analysis/3nnG7AM9QopHVPEuLX3Khk,260533,4," from walking home and talking loads to seeing shows in evening clothes with you from nervous touch and getting drunk to staying up and waking up with you   so, come on, let it go, just let it be why don't you be you, and i'll be me? everything that's broke, leave it to the breeze why don't you be you, and i'll be me? and i'll be me   i used to recognize myself it's funny how reflections change when we're becoming something else i think it's time to walk away see james bay liveget tickets as low as $65you might also like tryna fit your hand inside of mine when we know it just don't belong 'cause no force on earth could make it feel right, no, no tryna push this problem up the hill when it's just too heavy to hold i think now's the time to let it slide   come on, let it go, just let it be why don't you be you, and i'll be me? and i'll be me (ooh, me, you)6",69
Here,Alessia Cara,"159 ContributorsTranslationsDeutschالعربيةHere Lyrics[Written by Alessia Cara & Sebastian Kole]
[Produced by Pop & Oak and Sebastian Kole]

[Intro: Isaac Hayes]
I guess right now you've got the last laugh

[Verse 1]
I'm sorry if I seem uninterested
Or I'm not listenin' or I'm indifferent
Truly I ain't got no business here
But since my friends are here, I just came to kick it
But really, I would rather be at home all by myself
Not in this room with people who don't even care about my well-being
I don't dance, don't ask, I don't need a boyfriend
So, you can go back, please, enjoy your party
I'll be here, somewhere in the corner
Under clouds of marijuana with this boy who's hollerin'
I can hardly hear
Over this music I don't listen to and I don't wanna get with you
So, tell my friends that I'll be over here

[Chorus]
Oh-oh-oh, here, oh-oh-oh, here
Oh-oh-oh, I ask myself, what am I doin' here?
Oh-oh-oh, here, oh-oh-oh, here
And I can't wait 'til we can break up out of here
You might also like[Verse 2]
Excuse me if I seem a little unimpressed with this
An anti-social pessimist, but usually I don't mess with this
And I know you mean only the best
And your intentions aren't to bother me, but honestly, I'd rather be
Somewhere with my people, we can kick it and just listen to
Some music with a message, like we usually do
And we'll discuss our big dreams, how we plan to take over the planet
So, pardon my manners, I hope you'll understand that I'll be here
Not there in the kitchen
With the girl who's always gossipin' about her friends
So, tell them I'll be here
Right next to the boy who's throwin' up
'Cause he can't take what's in his cup no more
Oh God, why am I here?

[Chorus]
Oh-oh-oh, here, oh-oh-oh, here
Oh-oh-oh, I ask myself, what am I doin' here?
Oh-oh-oh, here, oh-oh-oh, here
And I can't wait 'til we can break up out of here
[Bridge]
Hours later, congregatin' next to the refrigerator
Some girl talkin' 'bout her haters, she ain't got none
How did it ever come to this? I should've never come to this
So holla at me, I'll be in the car when you're done
I'm stand-offish, don't want what you're offerin'
And I'm done talkin', awfully sad it had to be that way
So tell my people when they're ready that I'm ready
And I'm standin' by the TV with my beanie low
Yo, I'll be over here
[Chorus]
Oh-oh-oh, here, oh-oh-oh, here
Oh-oh-oh, I ask myself, what am I doin' here?
Oh-oh-oh, here, oh-oh-oh, here
And I can't wait till we can break up out of here407Embed","['Alessia Cara', 'Pop Wansel', 'Coleridge Tillman', 'Isaac Hayes', 'Bobby Brass', 'Samuel Gerongco', '林家謙 (Terence Lam)', 'OAK']","['Sebastian Kole', 'Kevin “Batos” Guardado', 'Pop & Oak']",1778100,0.376,0.822,0,-3.974,1,0.104,0.0783,0.0,0.0841,0.327,120.498,audio_features,5zUQZjVB6bfewBXWqsP9PY,spotify:track:5zUQZjVB6bfewBXWqsP9PY,https://api.spotify.com/v1/tracks/5zUQZjVB6bfewBXWqsP9PY,https://api.spotify.com/v1/audio-analysis/5zUQZjVB6bfewBXWqsP9PY,199453,4,"  i guess right now you've got the last laugh   oh-oh-oh, here, oh-oh-oh, here oh-oh-oh, i ask myself, what am i doin' here? oh-oh-oh, here, oh-oh-oh, here and i can't wait 'til we can break up out of here you might also like oh-oh-oh, here, oh-oh-oh, here oh-oh-oh, i ask myself, what am i doin' here? oh-oh-oh, here, oh-oh-oh, here and i can't wait 'til we can break up out of here  oh-oh-oh, here, oh-oh-oh, here oh-oh-oh, i ask myself, what am i doin' here? oh-oh-oh, here, oh-oh-oh, here and i can't wait till we can break up out of here40",69
The Hills,The Weeknd,"369 ContributorsTranslationsTürkçeEspañolРусскийPortuguêsFrançaisفارسیPolskiPortuguêsDeutschItalianoThe Hills Lyrics[Intro]
Yeah
Yeah
Yeah

[Verse 1]
Your man on the road, he doin' promo
You said, ""Keep our business on the low-low""
I'm just tryna get you out the friend zone
'Cause you look even better than the photos
I can't find your house, send me the info
Drivin' through the gated residential
Found out I was comin', sent your friends home
Keep on tryna hide it, but your friends know

[Chorus]
I only call you when it's half-past five
The only time that I'll be by your side
I only love it when you touch me, not feel me
When I'm fucked up, that's the real me
When I'm fucked up, that's the real me, yeah
I only call you when it's half-past five
The only time I'd ever call you mine
I only love it when you touch me, not feel me
When I'm fucked up, that's the real me
When I'm fucked up, that's the real me, babe
See The Weeknd LiveGet tickets as low as $88You might also like[Verse 2]
I'ma let you know and keep it simple
Tryna keep it up don't seem so simple
I just fucked two bitches 'fore I saw you
And you gon' have to do it at my tempo
Always tryna send me off to rehab
Drugs started feelin' like it's decaf
I'm just tryna live life for the moment
And all these motherfuckers want a relapse

[Chorus]
I only call you when it's half-past five
The only time that I'll be by your side
I only love it when you touch me, not feel me
When I'm fucked up, that's the real me
When I'm fucked up, that's the real me, yeah
I only call you when it's half-past five
The only time I'd ever call you mine
I only love it when you touch me, not feel me
When I'm fucked up, that's the real me
When I'm fucked up, that's the real me, babe

[Bridge]
Hills have eyes, the hills have eyes
Who are you to judge? Who are you to judge?
Hide your lies, girl, hide your lies (Hide your lies, oh, baby)
Only you to trust, only you
[Chorus]
I only call you when it's half-past five
The only time that I'll be by your side
I only love it when you touch me, not feel me
When I'm fucked up, that's the real me
When I'm fucked up, that's the real me, yeah
I only call you when it's half-past five
The only time I'd ever call you mine
I only love it when you touch me, not feel me
When I'm fucked up, that's the real me
When I'm fucked up, that's the real me, babe

[Outro]
Ewedihalehu
Yene konjo, ewedihalehu
Yene fikir, fikir, fikir, fikir
Yene fikir, fikir, fikir, fikir
Ewedihalehu
Yene konjo, ewedihalehu...1.8KEmbed","['Thomas Raybould', 'Belly', 'The Weeknd', 'Mano', 'Illangelo']","['Mano', 'Illangelo']",727466,0.585,0.564,0,-7.063,0,0.0515,0.0671,0.0,0.135,0.137,113.003,audio_features,7fBv7CLKzipRk6EC6TWHOB,spotify:track:7fBv7CLKzipRk6EC6TWHOB,https://api.spotify.com/v1/tracks/7fBv7CLKzipRk6EC6TWHOB,https://api.spotify.com/v1/audio-analysis/7fBv7CLKzipRk6EC6TWHOB,242253,4," yeah yeah yeah   i only call you when it's half-past five the only time that i'll be by your side i only love it when you touch me, not feel me when i'm fucked up, that's the real me when i'm fucked up, that's the real me, yeah i only call you when it's half-past five the only time i'd ever call you mine i only love it when you touch me, not feel me when i'm fucked up, that's the real me when i'm fucked up, that's the real me, babe see the weeknd liveget tickets as low as $88you might also like i only call you when it's half-past five the only time that i'll be by your side i only love it when you touch me, not feel me when i'm fucked up, that's the real me when i'm fucked up, that's the real me, yeah i only call you when it's half-past five the only time i'd ever call you mine i only love it when you touch me, not feel me when i'm fucked up, that's the real me when i'm fucked up, that's the real me, babe   i only call you when it's half-past five the only time that i'll be by your side i only love it when you touch me, not feel me when i'm fucked up, that's the real me when i'm fucked up, that's the real me, yeah i only call you when it's half-past five the only time i'd ever call you mine i only love it when you touch me, not feel me when i'm fucked up, that's the real me when i'm fucked up, that's the real me, babe  [outro] ewedihalehu yene konjo, ewedihalehu yene fikir, fikir, fikir, fikir yene fikir, fikir, fikir, fikir ewedihalehu yene konjo, ewedihalehu...1.8k",84
Mountain at My Gates,Foals,"33 ContributorsMountain at My Gates Lyrics[Verse 1]
I see a mountain at my gates
I see it more and more each day
What I give, it takes away
Whether I go or when I stay

[Verse 2]
I see a mountain at my gates
I see it more and more each day
I see a fire out by the lake
I'll drive my car without the brakes

[Verse 3]
I see a mountain in my way
It's looming larger by the day
I see a darkness in my fate
I'll drive my car without the brakes

[Pre-Chorus]
Oh, gimme some time
Show me the foothold from which I can climb
Yeah, when I feel low
You show me a signpost for where I should go

[Chorus]
I see a mountain at my gates
I see it more and more each day
And my desire wears a dark dress
Ah, each day, I see you less
You might also like[Build]
Oh, gimme some time
Show me the foothold from which I can climb
Yeah, when I feel low
You show me a signpost for where I should go

[Bridge]
Through lanes and stone rows
Black granite, wind blows
Fire lake and far flame
Go now but come again
Dark clouds gather 'round
Will I run or stand my ground?

[Build]
Oh, when I come to climb
Show me the mountain so far behind
Yeah, it's farther away
Its shadow gets smaller day after day

[Guitar Solo]

[Outro]
Yeah, gimme my lungs
Gimme my love
Gimme my choice
You keep me coming around
Will I stay?
Gimme my lungs
Gimme my voice
You keep me coming around
Gimme my lungs
Gimme my, gimme my, gimme my, gimme my, come on
Gimme my, gimme my, gimme my, gimme my way
Will I stay?
Gimme my lungs
Gimme my choice
You keep me coming 'round30Embed","['Yannis Philippakis', 'Foals']",['James Ford'],2253310,0.495,0.931,2,-5.336,0,0.0469,0.0025,0.0819,0.246,0.617,104.05,audio_features,3f7OyfSoDbQC0LRDQiytPp,spotify:track:3f7OyfSoDbQC0LRDQiytPp,https://api.spotify.com/v1/tracks/3f7OyfSoDbQC0LRDQiytPp,https://api.spotify.com/v1/audio-analysis/3f7OyfSoDbQC0LRDQiytPp,244293,4," i see a mountain at my gates i see it more and more each day what i give, it takes away whether i go or when i stay   i see a mountain in my way it's looming larger by the day i see a darkness in my fate i'll drive my car without the brakes   i see a mountain at my gates i see it more and more each day and my desire wears a dark dress ah, each day, i see you less you might also like through lanes and stone rows black granite, wind blows fire lake and far flame go now but come again dark clouds gather 'round will i run or stand my ground?    [outro] yeah, gimme my lungs gimme my love gimme my choice you keep me coming around will i stay? gimme my lungs gimme my voice you keep me coming around gimme my lungs gimme my, gimme my, gimme my, gimme my, come on gimme my, gimme my, gimme my, gimme my way will i stay? gimme my lungs gimme my choice you keep me coming 'round3",63
Dear Future Husband,Meghan Trainor,"66 ContributorsTranslationsEnglishDear Future Husband Lyrics[Chorus]
Dear future husband
Here's a few things you'll need to know if
You wanna be my one and only
All my life

[Verse 1]
Take me on a date, I deserve it, babe
And don't forget the flowers every anniversary
'Cause if you'll treat me right, I'll be the perfect wife
Buying groceries, buy-buying what you need
You got the 9 to 5, but baby, so do I
So don't be thinkin' I'll be home and baking apple pies
I never learned to cook, but I can write a hook
Sing along with me, sing, sing along with me (Hey)
[Pre-Chorus]
You've gotta know how to treat me like a lady
Even when I'm actin' crazy
Tell me everything's alright

[Chorus]
Dear future husband
Here's a few things you'll need to know if
You wanna be my one and only
All my life
Dear future husband
If you wanna get that special loving
Tell me I'm beautiful each and every night (Woo)
See Meghan Trainor LiveGet tickets as low as $19You might also like[Verse 2]
After every fight, just apologize
And maybe then I'll let you try and rock my body right
Even if I was wrong, you know I'm never wrong
Why disagree, why, why disagree
[Pre-Chorus]
You've gotta know how to treat me like a lady
Even when I'm actin' crazy
Tell me everything's alright (Alright)

[Chorus]
Dear future husband
Here's a few things you'll need to know if
You wanna be my one and only
All my life (Hey baby, hey)
Dear future husband
Make time for me, don't leave me lonely
And no, we'll never see your family more than mine

[Bridge]
I'll be sleeping on the left side of the bed (Hey)
Open doors for me and you might get some... kisses
Don't have a dirty mind, just be a classy guy
Buy me a ring, buy, buy me a ring, babe
[Pre-Chorus]
You've gotta know how to treat me like a lady
Even when I'm actin' crazy
Tell me everything's alright (Woo, hey)

[Chorus]
Dear future husband
Here's a few things you'll need to know if
You wanna be my one and only
All my life
Dear future husband
If you wanna get that special lovin'
Tell me I'm beautiful each and every night (That's right)
(Oh, whoa) Future husband, better love me right101Embed","['Kevin Kadish', 'Meghan Trainor']",['Kevin Kadish'],513887,0.655,0.782,1,-4.789,1,0.185,0.375,0.0,0.317,0.832,79.427,audio_features,3cU2wBxuV6nFiuf6PJZNlC,spotify:track:3cU2wBxuV6nFiuf6PJZNlC,https://api.spotify.com/v1/tracks/3cU2wBxuV6nFiuf6PJZNlC,https://api.spotify.com/v1/audio-analysis/3cU2wBxuV6nFiuf6PJZNlC,184227,4," dear future husband here's a few things you'll need to know if you wanna be my one and only all my life   you've gotta know how to treat me like a lady even when i'm actin' crazy tell me everything's alright   after every fight, just apologize and maybe then i'll let you try and rock my body right even if i was wrong, you know i'm never wrong why disagree, why, why disagree  dear future husband here's a few things you'll need to know if you wanna be my one and only all my life (hey baby, hey) dear future husband make time for me, don't leave me lonely and no, we'll never see your family more than mine   you've gotta know how to treat me like a lady even when i'm actin' crazy tell me everything's alright (woo, hey)  [chorus] dear future husband here's a few things you'll need to know if you wanna be my one and only all my life dear future husband if you wanna get that special lovin' tell me i'm beautiful each and every night (that's right) (oh, whoa) future husband, better love me right0",77
Worth It (feat. Kid Ink),Fifth Harmony,"101 ContributorsTranslationsEspañolPortuguêsPolskiFrançaisWorth It Lyrics[Chorus: Camila & Normani, Kid Ink]
Give it to me, I'm worth it
Baby, I'm worth it
Uh-huh, I'm worth it
Gimme, gimme, I'm worth it
Give it to me, I'm worth it
Baby (Uh), I'm worth it
Uh-huh (Uh), I'm worth it
Gimme, gimme (Uh), I'm worth it

[Post-Chorus: Kid Ink]
Okay, I tell her bring it back like she left some (I got some)
Bring it, bring it back like she left some (I got some)
Uh, in the club with the lights off
What you actin' shy fo'?
Come and show me that you
With it, with it, with it, with it, with it
Stop playin', how you know that I
With it, with it, with it, with it, with it
What you actin' shy for?

[Verse 1: Dinah]
Just give me you, just give me you
Just give me you, that's all I wanna do
And if what they say is true
If it's true, I might give me to you
I may talk a lot of stuff
Guaranteed I can back it up
I think I'ma call you bluff
Hurry up, I'm waitin' out front
You might also like[Pre-Chorus: Normani]
Uh-huh, you see me in the spot
Like ""Ooh, I love your style""
Uh-huh, show me what you got
'Cause I don't wanna waste my time
Uh-huh, see me in the spot
Like ""Ooh, I love your style""
Uh-huh, show me what you got now
Come and make it worth my while

[Chorus: Camila & Normani, Kid Ink]
Give it to me, I'm worth it
Baby, I'm worth it
Uh-huh, I'm worth it
Gimme, gimme, I'm worth it
Give it to me, I'm worth it
Baby (Uh), I'm worth it
Uh-huh (Uh), I'm worth it
Gimme, gimme, I'm worth it

[Verse 2: Camila]
It's all on you, it's all on you
It's all on you, so what you wanna do?
And if you don't have a clue
Not a clue, I'll tell you what to do
Come harder just because
I don't like it, like it too soft, too soft
I like it a little rough
Not too much, but maybe just enough
[Pre-Chorus: Ally]
Uh-huh, you see me in the spot
Like ""Ooh, I love your style""
Uh-huh, show me what you got
'Cause I don't wanna waste my time
Uh-huh, see me in the spot
Like ""Ooh, I love your style""
Uh-huh, show me what you got now
Come and make it worth my while

[Chorus: Camila & Normani, Camila, Kid Ink]
Give it to me, I'm worth it
Baby, I'm worth it
Uh-huh, I'm worth it
Gimme, gimme, I'm worth it
Give it to me, I'm worth it (Know what I mean?)
Baby (Uh), I'm worth it (Give me everythin')
Uh-huh (Uh), I'm worth it
Gimme, gimme (Uh), I'm worth it

[Post-Chorus: Kid Ink]
Okay, I tell her bring it back like she left some (I got some)
Bring it, bring it back like she left some (I got some)
Uh, in the club with the lights off
What you actin' shy fo'?
Come and show me that you
With it, with it, with it, with it, with it
Stop playin', how you know that I
With it, with it, with it, with it, with it
What you actin' shy for?
[Pre-Chorus: Ally & Normani, Ally]
Uh-huh, you see me in the spot
Like ""Ooh, I love your style""
Uh-huh, show me what you got
'Cause I don't wanna waste my time
Uh-huh, see me in the spot
Like ""Ooh, I love your style""
Uh-huh, show me what you got now
Come and make it worth my while

[Chorus: Camila & Normani, Camila, Kid Ink]
Give it to me, I'm worth it
Baby, I'm worth it
Uh-huh, I'm worth it
Gimme, gimme, I'm worth it
Give it to me, I'm worth it (Know what I mean?)
Baby (Uh), I'm worth it (Give me everythin')
Uh-huh (Uh), I'm worth it
Gimme, gimme, I'm worth it

[Outro: Camila]
Give it to me, I'm worth it112Embed","['Mikkel Storleer Eriksen', 'Ori Kaplan - אורי קפלן', 'Priscilla Renea', 'Tor Erik Hermansen']","['Ori Kaplan - אורי קפלן', 'Stargate']",669122,0.884,0.765,8,-3.865,1,0.0882,0.063,7.04e-06,0.118,0.594,99.987,audio_features,41Fflg7qHiVOD6dEPvsCzO,spotify:track:41Fflg7qHiVOD6dEPvsCzO,https://api.spotify.com/v1/tracks/41Fflg7qHiVOD6dEPvsCzO,https://api.spotify.com/v1/audio-analysis/41Fflg7qHiVOD6dEPvsCzO,224573,4," give it to me, i'm worth it baby, i'm worth it uh-huh, i'm worth it gimme, gimme, i'm worth it give it to me, i'm worth it baby (uh), i'm worth it uh-huh (uh), i'm worth it gimme, gimme (uh), i'm worth it   just give me you, just give me you just give me you, that's all i wanna do and if what they say is true if it's true, i might give me to you i may talk a lot of stuff guaranteed i can back it up i think i'ma call you bluff hurry up, i'm waitin' out front you might also like give it to me, i'm worth it baby, i'm worth it uh-huh, i'm worth it gimme, gimme, i'm worth it give it to me, i'm worth it baby (uh), i'm worth it uh-huh (uh), i'm worth it gimme, gimme, i'm worth it   uh-huh, you see me in the spot like ""ooh, i love your style"" uh-huh, show me what you got 'cause i don't wanna waste my time uh-huh, see me in the spot like ""ooh, i love your style"" uh-huh, show me what you got now come and make it worth my while   okay, i tell her bring it back like she left some (i got some) bring it, bring it back like she left some (i got some) uh, in the club with the lights off what you actin' shy fo'? come and show me that you with it, with it, with it, with it, with it stop playin', how you know that i with it, with it, with it, with it, with it what you actin' shy for?  give it to me, i'm worth it baby, i'm worth it uh-huh, i'm worth it gimme, gimme, i'm worth it give it to me, i'm worth it (know what i mean?) baby (uh), i'm worth it (give me everythin') uh-huh (uh), i'm worth it gimme, gimme, i'm worth it   give it to me, i'm worth it11",72
