Track Name,Artist Name,Lyrics,Writers,Producers,Genius_ID,danceability,energy,key,loudness,mode,speechiness,acousticness,instrumentalness,liveness,valence,tempo,type,id,uri,track_href,analysis_url,duration_ms,time_signature,clean_lyrics,Popularity
THE SCOTTS,THE SCOTTS,"172 ContributorsTranslationsEspañolTürkçeРусскийPortuguêsDeutschEnglishDansk中文THE SCOTTS Lyrics[Intro: Travis Scott]
Let's go

[Verse 1: Travis Scott & Kid Cudi]
We see the hype outside (Yeah)
Right from the house, uh
Took it straight from outside (Yeah)
Straight to the couch (Mmm)
We put the mic outside (Yeah)
Air this shit out, uh (Mmm)
You lettin' THE SCOTTS outside (Yeah)
We runnin' the scouts (Mmm)
Ain't no controllin' the gang (Yeah, yeah, yeah)
They never leave (Mmm)
I got tats over my veins (Yeah)
'Cause that what I bleed (Mmm)
She drink a lot of the bourbon (Yeah)
Like she from the street (Mmm)
We got control of the flows and, huh, uh, uh (Yeah, mmm)
We heard that your way went dry (Yeah)
We floodin' the drought, uh (Mmm)
Heard that your hood outside (Yeah)
We added some routes (Mmm)
We havin' the goods outside (Mmm)
Move it in and out (Mmm)
You lettin' THE SCOTTS outside (Mmm)
We runnin' the scouts
You might also like[Verse 2: Kid Cudi]
Nigga, the cops outside (Yeah)
Lock up the house (Yeah, yeah)
We keep the team on high (Huh)
Some gold in they mouth (Yeah, yeah)
Nigga, the Porsche outside (Huh)
Without the top (Yeah, yeah, nigga, yeah)
She want a mimosa-sa (Yeah)
Bring in the shots (Yeah, yeah, yeah)
Tell these phony bitches, ""Beat it""
With that Photoshoppin' body, Adobe, help me
She in there makin' panini
She know I got all the bread, she know me, got it
On my hustle, havin' visions
It's been a minute since my niggas done owned it, howdy (Huh, huh)
Cleveland boy, he make 'em pay
Yes, that Cleveland boy, he done made a way, hey
Headed for somewhere to go, anywhere cinema these, these
Niggas don't know where to go, gotta keep givin' em heat, heat (Yeah)
Time to go double though, time they add up the math, mad
And I've been dealin' with so many things, havin' so many dreams

[Outro: Travis Scott]
Let's go114Embed","['Plain Pat', 'Dot Da Genius', 'MIKE DEAN', 'Denzel Baptiste', 'David Biral', 'Kid Cudi', 'Travis Scott']","['MIKE DEAN', 'Dot Da Genius', 'Plain Pat', 'Take a Daytrip']",5493340,0.716,0.537,0,-7.648,0,0.0514,0.233,0.0,0.157,0.28,129.979,audio_features,39Yp9wwQiSRIDOvrVg7mbk,spotify:track:39Yp9wwQiSRIDOvrVg7mbk,https://api.spotify.com/v1/tracks/39Yp9wwQiSRIDOvrVg7mbk,https://api.spotify.com/v1/audio-analysis/39Yp9wwQiSRIDOvrVg7mbk,165978,4," let's go   we see the hype outside (yeah) right from the house, uh took it straight from outside (yeah) straight to the couch (mmm) we put the mic outside (yeah) air this shit out, uh (mmm) you lettin' the scotts outside (yeah) we runnin' the scouts (mmm) ain't no controllin' the gang (yeah, yeah, yeah) they never leave (mmm) i got tats over my veins (yeah) 'cause that what i bleed (mmm) she drink a lot of the bourbon (yeah) like she from the street (mmm) we got control of the flows and, huh, uh, uh (yeah, mmm) we heard that your way went dry (yeah) we floodin' the drought, uh (mmm) heard that your hood outside (yeah) we added some routes (mmm) we havin' the goods outside (mmm) move it in and out (mmm) you lettin' the scotts outside (mmm) we runnin' the scouts you might also like nigga, the cops outside (yeah) lock up the house (yeah, yeah) we keep the team on high (huh) some gold in they mouth (yeah, yeah) nigga, the porsche outside (huh) without the top (yeah, yeah, nigga, yeah) she want a mimosa-sa (yeah) bring in the shots (yeah, yeah, yeah) tell these phony bitches, ""beat it"" with that photoshoppin' body, adobe, help me she in there makin' panini she know i got all the bread, she know me, got it on my hustle, havin' visions it's been a minute since my niggas done owned it, howdy (huh, huh) cleveland boy, he make 'em pay yes, that cleveland boy, he done made a way, hey headed for somewhere to go, anywhere cinema these, these niggas don't know where to go, gotta keep givin' em heat, heat (yeah) time to go double though, time they add up the math, mad and i've been dealin' with so many things, havin' so many dreams   let's go11",73.0
Safaera,Bad Bunny,"66 ContributorsTranslationsDeutschEnglishSafaera Lyrics[Letra de ""Safaera""]

[Intro: Randy Nota Loca & Jowell]
Bla, bla, bla, bla, bla, bla
Ey, yo, yo, yo
Yo, yo, yo, yo, yah
Lalalalalalala (Blow, blow)
Lalalalalalala

[Refrán: Randy Nota Loca & Jowell]
Diablo, qué safaera
Tú tiene' un culo cabrón
Cualquier cosa que te ponga' rompe la carretera (Lalalalala; aight)
Muévelo, muévelo, muévelo, muévelo (Lalalalalalala)
Qué safaera (Lalalalala)
Tiene' un culo cabrón
Cualquier cosa que te ponga' rompe la carretera (Aight; ¡tra!)
Muévelo, muévelo, muévelo, muévelo

[Verso 1: Randy Nota Loca]
Qué falta de respeto, mami
¿Cómo te atreve' a venir sin panty?
Hoy saliste puesta pa' mí
Yo que pensaba que venía a dormir, no
Vino ready ya, puesta pa' una cepillá'
Me chupa la lollipop, solita se arrodilla, hey
¿Cómo te atreve', mami, a venir sin panty?
You might also like[Interludio: Ñengo Flow & Bad Bunny]
Mera, dímelo, DJ Orma
¿Qué tú te cree'? Jodío' cabrón, jeje
Yo Hago Lo Que Me Da La Gana
Díselo, Conejo
Ey, ey (Jajajaja)

[Coro: Bad Bunny & Ñengo Flow]
Hoy se bebe, hoy se gasta
Hoy se fuma como un rasta
Si Dio' lo permite (Si Dio' lo permite), ey
Si Dio' lo permite (Que si Dio' lo permite), ey
Hoy se bebe, hoy se gasta
Hoy se fuma como un rasta (Woo, woo, woo)
Si Dio' lo permite (Jajajajaja), ey
Si Dio' lo permite (Yo, yo), ey

[Verso 2: Ñengo Flow]
Real G, orientando la' generacione' nueva', con la verdadera
Bellaqueo a lo galactic
Sí, pa' que se te mojen los panty
Métele bellaco a lo versátil
Má' puta que Betty Boop
La que se puso bellaca, mami, fuiste tú
Sigo matando con la U
Chocha con bicho, bicho con nalga (Empuja)
Cho-Chocha con bicho, bicho con nalga, sí (Empuja)
Chocha con bicho, bicho con nalga (Empuja)
Te-Teta' rozando mis tetilla' (Empuja)
Este año no quiero putilla' (Empuja)
Te ven con mucha' prenda' y te quieren pegar (Empuja)
Te ven bien activa'o y te quieren pegar (Empuja)
Porque está' bien buena, porque está' bien buena (Empújamelo completo)
Teta' bien grande' como Lourdes Chacón
Las nalga' bien grande' como Iris Chacón
La chocha no sé porque no la he visto
Pero vamo' pa' la cama a clavarte en panty
[Coro: Randy Nota Loca]
Hoy se bebe, hoy se gasta
Hoy se fuma como un rasta
Si Dio' lo permite
Si Dio' lo permite, yeah-yeah
Y hoy se bebe, hoy se gasta
Hoy se fuma como un rasta
Si Dio' lo permite
Si Dio' lo permite (-te, -te, -te, -te, -te, -te)

[Verso 3: Randy Nota Loca, Bad Bunny & Baby Ranks]
(¡Arr-ugh!)
Mami, ¿qué tú quiere'? Aquí llegó tu tiburón
Yo quiero perrearte y fumarme un blunt
Ver lo que esconde ese pantalón
Yo quiero perrearte y perrearte y perrearte (Duro, duro)
Yo-Yo-Yo quiero perrearte y fumarme un blunt (Duro, duro)
Yo quiero perrearte y perrearte y perrear (Duro, duro)
Yo-Yo-Yo quiero perrearte y fumarme un blunt, -me un blunt (Duro, duro)
La rola ya me explotó
La nena bailando se botó
Ese culo se merece to', se merece to', se merece to', yes
Ese culo se merece to', se merece to', se merece to' (Ey, ey, ey, ey, ey)

[Interludio: Bad Bunny]
¡Ah! Yo pensaba que se ponía lenta
'Tá bien, 'tá bien, vamo' de nuevo, de nuevo
Velen a Orma, velen a Orma que está bellaco
Jajajaja (Jajajaja, jajajaja)
[Verso 4: Bad Bunny]
Mi bicho anda fuga'o y yo quiero que tú me lo esconda'
Agárralo como bonga
Se mete una pepa que la pone cachonda
Chinga en lo' Audi, no en lo' Honda, ey (Tra)
Si te lo meto no me llame' (Tra, tra)
Que esto no e' pa' que me ame', ey (Tra, tra)
Si tu novio no te mama el culo
Pa' eso que no mame

[Puente: Bad Bunny]
Baja pa' casa que yo te lambo to'a
Mami, yo te lambo to'a
Baja pa' casa que yo te rompo to'a, ey
Que yo te rompo to'a
Baja pa' casa que yo te lambo to'a (¡Papi, sigue!)
Mami, yo te lambo to'a (¡Papi, sigue!)
Dime, sierva (Papi, sigue)
Si tú fuma' yerba (Papi, pa-papi)

[Verso 5: Jowell]
Jowell, bebé, bebé, bebé, jaja, ¡jajajajaja!
Perreando e' la bichota (¡Duro!)
Se ve que chinga rico en la nota
Yo quiero tirarme un selfie con esa' nalgota' (Tra, tra; wow)
Para'o, para'o, para'o lo tengo, se me nota (Woh, woh)
¿Qué vamo' a hacer con esa' nalgota'? (What?)
En la uni to'a son A, A, A (Tra)
Pero esa' teta' son C
Tú ere' una superbellaca (Wuh), mami, yo lo sé (Eh)
Yo también soy un bellaco (Tra), ¿qué vamo' a hacer? (Tú sabe', eh)
Con ese bum-bum, guíllate, bum-bum
Guíllate ese bum-bum, guíllate, bum-bum
Si tiene' ese bum-bum, guíllate, bum-bum
Si tiene' ese bum-bum, guíllate, ¡buoh!12Embed","['Missy Elliott', 'Sting International', 'Timbaland', 'DJ Orma', 'Tainy', 'Randy', 'Jowell', 'Ñengo Flow', 'Bad Bunny']","['DJ Orma', 'Tainy']",5305013,0.607,0.829,2,-4.074,1,0.379,0.0103,0.0,0.107,0.685,96.172,audio_features,2DEZmgHKAvm41k4J3R2E9Y,spotify:track:2DEZmgHKAvm41k4J3R2E9Y,https://api.spotify.com/v1/tracks/2DEZmgHKAvm41k4J3R2E9Y,https://api.spotify.com/v1/audio-analysis/2DEZmgHKAvm41k4J3R2E9Y,295177,4,"   bla, bla, bla, bla, bla, bla ey, yo, yo, yo yo, yo, yo, yo, yah lalalalalalala (blow, blow) lalalalalalala   diablo, qué safaera tú tiene' un culo cabrón cualquier cosa que te ponga' rompe la carretera (lalalalala; aight) muévelo, muévelo, muévelo, muévelo (lalalalalalala) qué safaera (lalalalala) tiene' un culo cabrón cualquier cosa que te ponga' rompe la carretera (aight; ¡tra!) muévelo, muévelo, muévelo, muévelo   qué falta de respeto, mami ¿cómo te atreve' a venir sin panty? hoy saliste puesta pa' mí yo que pensaba que venía a dormir, no vino ready ya, puesta pa' una cepillá' me chupa la lollipop, solita se arrodilla, hey ¿cómo te atreve', mami, a venir sin panty? you might also like mera, dímelo, dj orma ¿qué tú te cree'? jodío' cabrón, jeje yo hago lo que me da la gana díselo, conejo ey, ey (jajajaja)   hoy se bebe, hoy se gasta hoy se fuma como un rasta si dio' lo permite (si dio' lo permite), ey si dio' lo permite (que si dio' lo permite), ey hoy se bebe, hoy se gasta hoy se fuma como un rasta (woo, woo, woo) si dio' lo permite (jajajajaja), ey si dio' lo permite (yo, yo), ey   real g, orientando la' generacione' nueva', con la verdadera bellaqueo a lo galactic sí, pa' que se te mojen los panty métele bellaco a lo versátil má' puta que betty boop la que se puso bellaca, mami, fuiste tú sigo matando con la u chocha con bicho, bicho con nalga (empuja) cho-chocha con bicho, bicho con nalga, sí (empuja) chocha con bicho, bicho con nalga (empuja) te-teta' rozando mis tetilla' (empuja) este año no quiero putilla' (empuja) te ven con mucha' prenda' y te quieren pegar (empuja) te ven bien activa'o y te quieren pegar (empuja) porque está' bien buena, porque está' bien buena (empújamelo completo) teta' bien grande' como lourdes chacón las nalga' bien grande' como iris chacón la chocha no sé porque no la he visto pero vamo' pa' la cama a clavarte en panty  hoy se bebe, hoy se gasta hoy se fuma como un rasta si dio' lo permite si dio' lo permite, yeah-yeah y hoy se bebe, hoy se gasta hoy se fuma como un rasta si dio' lo permite si dio' lo permite (-te, -te, -te, -te, -te, -te)   (¡arr-ugh!) mami, ¿qué tú quiere'? aquí llegó tu tiburón yo quiero perrearte y fumarme un blunt ver lo que esconde ese pantalón yo quiero perrearte y perrearte y perrearte (duro, duro) yo-yo-yo quiero perrearte y fumarme un blunt (duro, duro) yo quiero perrearte y perrearte y perrear (duro, duro) yo-yo-yo quiero perrearte y fumarme un blunt, -me un blunt (duro, duro) la rola ya me explotó la nena bailando se botó ese culo se merece to', se merece to', se merece to', yes ese culo se merece to', se merece to', se merece to' (ey, ey, ey, ey, ey)   ¡ah! yo pensaba que se ponía lenta 'tá bien, 'tá bien, vamo' de nuevo, de nuevo velen a orma, velen a orma que está bellaco jajajaja (jajajaja, jajajaja)  mi bicho anda fuga'o y yo quiero que tú me lo esconda' agárralo como bonga se mete una pepa que la pone cachonda chinga en lo' audi, no en lo' honda, ey (tra) si te lo meto no me llame' (tra, tra) que esto no e' pa' que me ame', ey (tra, tra) si tu novio no te mama el culo pa' eso que no mame   baja pa' casa que yo te lambo to'a mami, yo te lambo to'a baja pa' casa que yo te rompo to'a, ey que yo te rompo to'a baja pa' casa que yo te lambo to'a (¡papi, sigue!) mami, yo te lambo to'a (¡papi, sigue!) dime, sierva (papi, sigue) si tú fuma' yerba (papi, pa-papi)   jowell, bebé, bebé, bebé, jaja, ¡jajajajaja! perreando e' la bichota (¡duro!) se ve que chinga rico en la nota yo quiero tirarme un selfie con esa' nalgota' (tra, tra; wow) para'o, para'o, para'o lo tengo, se me nota (woh, woh) ¿qué vamo' a hacer con esa' nalgota'? (what?) en la uni to'a son a, a, a (tra) pero esa' teta' son c tú ere' una superbellaca (wuh), mami, yo lo sé (eh) yo también soy un bellaco (tra), ¿qué vamo' a hacer? (tú sabe', eh) con ese bum-bum, guíllate, bum-bum guíllate ese bum-bum, guíllate, bum-bum si tiene' ese bum-bum, guíllate, bum-bum si tiene' ese bum-bum, guíllate, ¡buoh!1",73.0
Boss Bitch,Doja Cat,"95 ContributorsTranslationsEspañolPortuguêsΕλληνικάShqipItalianoPolskiDeutschBoss Bitch Lyrics[Intro]
Mmm
I ain't tryna (Ah)
I ain't tryna
I ain't tryna

[Verse 1]
Yeah, ain't tryna be cool like you
Wobblin' around in your high heel shoes
I'm clumsy, made friends with the floor
Two for one, you know a bitch buy four
And two left feet, you know I always drop
First thing a girl did was a bop
I'm the whole damn cake and the cherry on top
Shook up the bottle, made a good girl pop

[Pre-Chorus]
You ain't even here to party
Ken in the club, tryna pipe a Barbie
I don't wanna go, go, go with the flow
Backbend 'til I touch my toes
I don't wanna row, row, row the boat
Wrist full of rocks and I hope I float
Big up yourself 'cause you know they don't
I chew, chew, chew 'cause they hope I choke
See Doja Cat LiveGet tickets as low as $25You might also like[Chorus]
I'm a bitch, I'm a boss
I'm a bitch and a boss, I'ma shine like gloss
I'm a bitch, I'm a boss
I'm a bitch and a boss, I'ma shine like gloss
I'm a bitch, I'm a boss
I'm a bitch and a boss, I'ma shine like gloss
I'm a bitch, I'm a boss
I'm a bitch and a boss, I'ma shine like gloss

[Verse 2]
Said bitch, I'm the after, you been the before
I been the stallion, you been the seahorse
Don't need a report, don't need a press run
All of my bad pics been all my best ones
I wear the hat and I wear the pants
I am advanced, so I get advance
And I do my dance and cancel the plans
Said boo, don't be mad 'cause you had the chance

[Pre-Chorus]
Drop, said I took it and I ran for it
I won it, then I stand on it
Money on the floor when we dance on it
Shine bright, let them put a tan on it
Said I took it and I ran for it
I won it, then I stand on it
Money on the floor when we dance on it
Shine bright, let them put a tan on it like
[Chorus]
I'm a bitch, I'm a boss
I'm a bitch and a boss, I'ma shine like gloss
I'm a bitch, I'm a boss
I'm a bitch and a boss, I'ma shine like gloss
I'm a bitch, I'm a boss
I'm a bitch and a boss, I'ma shine like gloss
I'm a bitch, I'm a boss
I'm a bitch and a boss, I'ma shine like gloss

[Bridge]
Rrrr, ah, ah, ah
I'm a bitch (I'm a bitch), I'm a boss (I'm a boss)
I'm a bitch (I'm a bitch), I'm a boss (I'm a boss)
I'm a bitch (I'm a bitch), I'm a boss (I'm a boss)
I'm a bitch and a boss, I'ma shine like gloss

[Chorus]
I'm a bitch, I'm a boss
I'm a bitch and a boss, I'ma shine like gloss
I'm a bitch, I'm a boss
I'm a bitch and a boss, I'ma shine like gloss
I'm a bitch, I'm a boss
I'm a bitch and a boss, I'ma shine like gloss
I'm a bitch, I'm a boss
I'm a bitch and a boss, I'ma shine like gloss49Embed","['Ashnikko', 'Doja Cat', 'Imad Royal', 'Sky Adams']","['Imad Royal', 'Sky Adams']",5101683,0.707,0.955,10,-4.593,0,0.222,0.127,0.0,0.202,0.575,125.989,audio_features,78qd8dvwea0Gosb6Fe6j3k,spotify:track:78qd8dvwea0Gosb6Fe6j3k,https://api.spotify.com/v1/tracks/78qd8dvwea0Gosb6Fe6j3k,https://api.spotify.com/v1/audio-analysis/78qd8dvwea0Gosb6Fe6j3k,134240,4," mmm i ain't tryna (ah) i ain't tryna i ain't tryna   yeah, ain't tryna be cool like you wobblin' around in your high heel shoes i'm clumsy, made friends with the floor two for one, you know a bitch buy four and two left feet, you know i always drop first thing a girl did was a bop i'm the whole damn cake and the cherry on top shook up the bottle, made a good girl pop   you ain't even here to party ken in the club, tryna pipe a barbie i don't wanna go, go, go with the flow backbend 'til i touch my toes i don't wanna row, row, row the boat wrist full of rocks and i hope i float big up yourself 'cause you know they don't i chew, chew, chew 'cause they hope i choke see doja cat liveget tickets as low as $25you might also like i'm a bitch, i'm a boss i'm a bitch and a boss, i'ma shine like gloss i'm a bitch, i'm a boss i'm a bitch and a boss, i'ma shine like gloss i'm a bitch, i'm a boss i'm a bitch and a boss, i'ma shine like gloss i'm a bitch, i'm a boss i'm a bitch and a boss, i'ma shine like gloss   said bitch, i'm the after, you been the before i been the stallion, you been the seahorse don't need a report, don't need a press run all of my bad pics been all my best ones i wear the hat and i wear the pants i am advanced, so i get advance and i do my dance and cancel the plans said boo, don't be mad 'cause you had the chance   drop, said i took it and i ran for it i won it, then i stand on it money on the floor when we dance on it shine bright, let them put a tan on it said i took it and i ran for it i won it, then i stand on it money on the floor when we dance on it shine bright, let them put a tan on it like  i'm a bitch, i'm a boss i'm a bitch and a boss, i'ma shine like gloss i'm a bitch, i'm a boss i'm a bitch and a boss, i'ma shine like gloss i'm a bitch, i'm a boss i'm a bitch and a boss, i'ma shine like gloss i'm a bitch, i'm a boss i'm a bitch and a boss, i'ma shine like gloss   rrrr, ah, ah, ah i'm a bitch (i'm a bitch), i'm a boss (i'm a boss) i'm a bitch (i'm a bitch), i'm a boss (i'm a boss) i'm a bitch (i'm a bitch), i'm a boss (i'm a boss) i'm a bitch and a boss, i'ma shine like gloss   i'm a bitch, i'm a boss i'm a bitch and a boss, i'ma shine like gloss i'm a bitch, i'm a boss i'm a bitch and a boss, i'ma shine like gloss i'm a bitch, i'm a boss i'm a bitch and a boss, i'ma shine like gloss i'm a bitch, i'm a boss i'm a bitch and a boss, i'ma shine like gloss4",76.0
Physical,Dua Lipa,"120 ContributorsTranslationsTürkçeEspañolفارسیNederlandsΕλληνικάFrançaisBahasa IndonesiaDeutschPhysical Lyrics[Verse 1]
Common love isn't for us
We created something phenomenal
Don't you agree?
Don't you agree?
You got me feeling diamond rich
Nothing on this planet compares to it
Don't you agree?
Don't you agree?

[Pre-Chorus]
Who needs to go to sleep when I got you next to me?

[Chorus]
All night, I'll riot with you
I know you got my back and you know I got you
So come on (Come on), come on (Come on), come on (Come on)
Let's get physical
Lights out, follow the noise
Baby, keep on dancing like you ain't got a choice
So come on (Come on), come on (Come on), come on
Let's get physical

[Verse 2]
Adrenaline keeps on rushing in
Love the simulation we're dreaming in
Don't you agree?
Don't you agree?
I don't wanna live another life
'Cause this one's pretty nice
Living it up
See Dua Lipa LiveGet tickets as low as $52You might also like[Pre-Chorus]
Who needs to go to sleep when I got you next to me?

[Chorus]
All night, I'll riot with you
I know you got my back and you know I got you
So come on (Come on), come on (Come on), come on (Come on)
Let's get physical
Lights out, follow the noise
Baby, keep on dancing like you ain't got a choice
So come on (Come on), come on (Come on), come on
Let's get physical

[Bridge]
Hold on just a little tighter
Come on, hold on, tell me if you're ready
Come on (Come on, come on)
Baby, keep on dancing
Let's get physical
Hold on just a little tighter
Come on, hold on, tell me if you're ready
Come on (Come on, come on)
Baby, keep on dancing
Let's get physical

[Chorus]
All night, I'll riot with you
I know you got my back and you know I got you
So come on, come on, come on
Let's get physical
Lights out, follow the noise
Baby, keep on dancing like you ain't got a choice
So come on (Come on), come on (Come on), come on
Let's get physical (Physical, physical)
[Outro]
Let's get physical (Physical, physical)
Physical (Physical, physical)
Let's get physical (Physical, physical)
Come on, phy-phy-phy-physical81Embed","['Clarence Coffee Jr.', 'KOZ', 'Sarah Hudson', 'Dua Lipa']","['Gian Stone', 'Lorna Blackwood', 'Jason Evigan', 'KOZ']",5153374,0.647,0.844,0,-3.756,1,0.0457,0.0137,0.000658,0.102,0.746,146.967,audio_features,3AzjcOeAmA57TIOr9zF1ZW,spotify:track:3AzjcOeAmA57TIOr9zF1ZW,https://api.spotify.com/v1/tracks/3AzjcOeAmA57TIOr9zF1ZW,https://api.spotify.com/v1/audio-analysis/3AzjcOeAmA57TIOr9zF1ZW,193829,4," common love isn't for us we created something phenomenal don't you agree? don't you agree? you got me feeling diamond rich nothing on this planet compares to it don't you agree? don't you agree?   who needs to go to sleep when i got you next to me?   all night, i'll riot with you i know you got my back and you know i got you so come on (come on), come on (come on), come on (come on) let's get physical lights out, follow the noise baby, keep on dancing like you ain't got a choice so come on (come on), come on (come on), come on let's get physical   adrenaline keeps on rushing in love the simulation we're dreaming in don't you agree? don't you agree? i don't wanna live another life 'cause this one's pretty nice living it up see dua lipa liveget tickets as low as $52you might also like who needs to go to sleep when i got you next to me?   all night, i'll riot with you i know you got my back and you know i got you so come on (come on), come on (come on), come on (come on) let's get physical lights out, follow the noise baby, keep on dancing like you ain't got a choice so come on (come on), come on (come on), come on let's get physical   hold on just a little tighter come on, hold on, tell me if you're ready come on (come on, come on) baby, keep on dancing let's get physical hold on just a little tighter come on, hold on, tell me if you're ready come on (come on, come on) baby, keep on dancing let's get physical   all night, i'll riot with you i know you got my back and you know i got you so come on, come on, come on let's get physical lights out, follow the noise baby, keep on dancing like you ain't got a choice so come on (come on), come on (come on), come on let's get physical (physical, physical)  let's get physical (physical, physical) physical (physical, physical) let's get physical (physical, physical) come on, phy-phy-phy-physical8",77.0
