Track Name,Artist Name,Lyrics,Writers,Producers,Genius_ID,danceability,energy,key,loudness,mode,speechiness,acousticness,instrumentalness,liveness,valence,tempo,type,id,uri,track_href,analysis_url,duration_ms,time_signature,clean_lyrics,Popularity
hot girl bummer,blackbear,"109 ContributorsTranslationsEspañol​hot girl bummer Lyrics[Intro]
Fuck you, and you, and you
I hate your friends and they hate me too
I'm through, I'm through, I'm through
This that hot girl bummer anthem
Turn it up and throw a tantrum

[Verse 1]
This that hot girl bummer anthem
Turn it up and throw a tantrum
This that throw up in your Birkin bag
Hook up with someone random
This that social awkward suicide
That buy your lips and buy your likes
I swear she had a man
But shit hit different when it's Thursday night

[Pre-Chorus]
That college dropout music
Every day leg day, she be too thick
And my friends are all annoying
But we go dumb, yeah, we go stupid
This that 10K on the table
Just so we can be secluded
And the vodka came diluted
One more line, I'm superhuman
You might also like[Chorus]
Fuck you, and you, and you
I hate your friends and they hate me too
I'm through, I'm through, I'm through
This that hot girl bummer anthem
Turn it up and throw a tantrum
Fuck you, and you, and you
I hate your friends and they hate me too
Fuck you, and you, and you
This that hot girl bummer anthem
Turn it up and throw a tantrum

[Verse 2]
This that hot girl bummer two-step
They can't box me in, I'm too left
This that drip, it's more like oceans
They can't fit me in a Trojan
Out of pocket, but I'm always in my bag
Yeah, that's the slogan
This that, ""Who's all there?""
I'm pullin' up wit' a emo chick that's broken

[Pre-Chorus]
This that college dropout music
Every day leg day, she be too thick
And my friends are all annoying
But we go dumb, yeah, we go stupid
This that 10K on the table
Just so we can be secluded
And the vodka came diluted
One more line, I'm superhuman
[Chorus]
Fuck you, and you, and you
I hate your friends and they hate me too
I'm through, I'm through, I'm through
This that hot girl bummer anthem
Turn it up and throw a tantrum
Fuck you, and you, and you
I hate your friends and they hate me too
Fuck you, and you, and you
This that hot girl bummer anthem
Turn it up and throw a tantrum

[Bridge]
This that college dropout music
Every day leg day, she be too thick
And my friends are all annoying
But we go dumb, yeah, we go stupid
This that college dropout music
Every day leg day, she be too thick
And my friends are all annoying
But we go dumb, yeah, we go stupid
We go stupid, we go stupid, we go—
And you want me to change? Fuck you!

[Chorus]
Fuck you, and you, and you
I hate your friends and they hate me too
I'm through, I'm through, I'm through
This that hot girl bummer anthem
Turn it up and throw a tantrum
Fuck you, and you, and you
I hate your friends and they hate me too
Fuck you, and you, and you
This that hot girl bummer anthem
Turn it up and throw a tantrum131Embed","['blackbear', 'Andrew Goldstein']","['Andrew Goldstein', 'blackbear']",4708753,0.782,0.559,6,-7.106,0,0.0767,0.125,0.0,0.385,0.685,129.992,audio_features,6jRq8gaZhMUyy5RclRPcAf,spotify:track:6jRq8gaZhMUyy5RclRPcAf,https://api.spotify.com/v1/tracks/6jRq8gaZhMUyy5RclRPcAf,https://api.spotify.com/v1/audio-analysis/6jRq8gaZhMUyy5RclRPcAf,188344,1," fuck you, and you, and you i hate your friends and they hate me too i'm through, i'm through, i'm through this that hot girl bummer anthem turn it up and throw a tantrum   this that hot girl bummer anthem turn it up and throw a tantrum this that throw up in your birkin bag hook up with someone random this that social awkward suicide that buy your lips and buy your likes i swear she had a man but shit hit different when it's thursday night   that college dropout music every day leg day, she be too thick and my friends are all annoying but we go dumb, yeah, we go stupid this that 0k on the table just so we can be secluded and the vodka came diluted one more line, i'm superhuman you might also like fuck you, and you, and you i hate your friends and they hate me too i'm through, i'm through, i'm through this that hot girl bummer anthem turn it up and throw a tantrum fuck you, and you, and you i hate your friends and they hate me too fuck you, and you, and you this that hot girl bummer anthem turn it up and throw a tantrum   this that hot girl bummer two-step they can't box me in, i'm too left this that drip, it's more like oceans they can't fit me in a trojan out of pocket, but i'm always in my bag yeah, that's the slogan this that, ""who's all there?"" i'm pullin' up wit' a emo chick that's broken   this that college dropout music every day leg day, she be too thick and my friends are all annoying but we go dumb, yeah, we go stupid this that 0k on the table just so we can be secluded and the vodka came diluted one more line, i'm superhuman  fuck you, and you, and you i hate your friends and they hate me too i'm through, i'm through, i'm through this that hot girl bummer anthem turn it up and throw a tantrum fuck you, and you, and you i hate your friends and they hate me too fuck you, and you, and you this that hot girl bummer anthem turn it up and throw a tantrum   this that college dropout music every day leg day, she be too thick and my friends are all annoying but we go dumb, yeah, we go stupid this that college dropout music every day leg day, she be too thick and my friends are all annoying but we go dumb, yeah, we go stupid we go stupid, we go stupid, we go— and you want me to change? fuck you!   fuck you, and you, and you i hate your friends and they hate me too i'm through, i'm through, i'm through this that hot girl bummer anthem turn it up and throw a tantrum fuck you, and you, and you i hate your friends and they hate me too fuck you, and you, and you this that hot girl bummer anthem turn it up and throw a tantrum3",75.0
"WHATS POPPIN (feat. DaBaby, Tory Lanez & Lil Wayne) - Remix",Jack Harlow,"152 ContributorsTranslationsPortuguêsWHATS POPPIN Lyrics[Chorus]
What's poppin'? (Pooh, you a fool for this one)
Brand new whip, just hopped in (Just hopped in)
I got options (Oh Lord, Jetson made another one)
I could pass that bitch like Stockton (It ain't nothin')
Just joshin'
I'ma spend this holiday locked in (Ooh)
My body got rid of them toxins (Mmh, mmh)
SportsCenter, top ten

[Verse]
I could put the ball in the end zone
Put a bad bitch in the friendzone, ooh
This shit sound like an intro
Jetson, give me that tempo, ooh
Told Pooh he a fool with this shit (He a fool)
Told her don't let her friends know (Don't)
In the 'Ville and I move like a don (Don)
Eating fettuccine at Vincenzo's
Me and my 'migos got that free smoke
On the West Coast, yeah, I'm talking 'bout pre-rolls (Pre-roll)
Dark haired bitch and she look like Shego (She do)
Hometown hero, feeling myself, can't murder my ego (Can't do it)
She heard of my deep stroke
She said, ""Babe, does it hurt when I deep throat?"" (It does)
Certified freak ho
Hang around us and she learnin' my lingo
Back then, wasn't worried 'bout me though
In the gym tryna work on my free throw
Goddamn (Goddamn)
Spending money at the club like Sam's (Cha-ching)
Yes, ma'am
She a lil' freak on cam (Facts)
But she don't put this on the 'Gram (Nah)
Lil' boys tryna diss on the 'Gram (Ayy)
I can't switch on the fam (Bitch)
Shit's hot, hit the switch on the fan (Hit that shit)
This where my head is (Listen)
I feel resentment from every direction
Even some homies be wearing expressions
I be discouraged from sharing my blessings (Damn)
We used to share a connection
Now it just feels like it's wearing and stretching
I'm getting real sick of taking advice
From people that never could stare at reflections (Ooh)
Somewhere in there is a lesson
Y'all ain't evolvin', it's very depressing
I'm at the club with the basketball team
Me and the Cardinals are sharing a section (Facts)
Gotta cherish the present
I'm drinking water and wearing protection
Got a career and I'm very invested
Some people call it a scary obsession (Ooh, period, but)
I like to call it a passion
I can't be sitting relaxin' (Nah, I can't)
PG, we getting some traction
I'm at the venue, it's packed in (Packed out)
I'm digging her accent
I got a B.B. Simon belt on me
And she tryna get it unfastened
That's my type of distraction
That's my type and she Latin (That's facts, ooh)
Got my own flow and I'm 'bout to get a patent
Brand new sheets for the bed, they satin (Soft, real soft)
Y'all wasn't tuned in back then (Nah)
My swag, they keep jackin' (Keep on jackin')
I ain't doin' no verse, quit askin' (Quit askin')
You might also like[Chorus]
What's poppin'? (Pooh, you a fool for this one)
Brand new whip, just hopped in (Just hopped in)
I got options
I could pass that bitch like Stockton (It ain't nothin')
Just joshin'
I'ma spend this holiday locked in (Ooh)
My body got rid of them toxins (Mmh, mmh)
SportsCenter, top ten75Embed","['JW Lucas', 'Nemo Achida', 'jetsonmade', 'Pooh Beatz', 'LosTheProducer', 'Jack Harlow']","['LosTheProducer', 'jetsonmade', 'Pooh Beatz', 'JW Lucas']",5189988,0.904,0.723,11,-5.224,0,0.26,0.0631,0.0,0.185,0.835,145.013,audio_features,2MbdDtCv5LUVjYy9RuGTgC,spotify:track:2MbdDtCv5LUVjYy9RuGTgC,https://api.spotify.com/v1/tracks/2MbdDtCv5LUVjYy9RuGTgC,https://api.spotify.com/v1/audio-analysis/2MbdDtCv5LUVjYy9RuGTgC,227478,4," what's poppin'? (pooh, you a fool for this one) brand new whip, just hopped in (just hopped in) i got options (oh lord, jetson made another one) i could pass that bitch like stockton (it ain't nothin') just joshin' i'ma spend this holiday locked in (ooh) my body got rid of them toxins (mmh, mmh) sportscenter, top ten   i could put the ball in the end zone put a bad bitch in the friendzone, ooh this shit sound like an intro jetson, give me that tempo, ooh told pooh he a fool with this shit (he a fool) told her don't let her friends know (don't) in the 'ville and i move like a don (don) eating fettuccine at vincenzo's me and my 'migos got that free smoke on the west coast, yeah, i'm talking 'bout pre-rolls (pre-roll) dark haired bitch and she look like shego (she do) hometown hero, feeling myself, can't murder my ego (can't do it) she heard of my deep stroke she said, ""babe, does it hurt when i deep throat?"" (it does) certified freak ho hang around us and she learnin' my lingo back then, wasn't worried 'bout me though in the gym tryna work on my free throw goddamn (goddamn) spending money at the club like sam's (cha-ching) yes, ma'am she a lil' freak on cam (facts) but she don't put this on the 'gram (nah) lil' boys tryna diss on the 'gram (ayy) i can't switch on the fam (bitch) shit's hot, hit the switch on the fan (hit that shit) this where my head is (listen) i feel resentment from every direction even some homies be wearing expressions i be discouraged from sharing my blessings (damn) we used to share a connection now it just feels like it's wearing and stretching i'm getting real sick of taking advice from people that never could stare at reflections (ooh) somewhere in there is a lesson y'all ain't evolvin', it's very depressing i'm at the club with the basketball team me and the cardinals are sharing a section (facts) gotta cherish the present i'm drinking water and wearing protection got a career and i'm very invested some people call it a scary obsession (ooh, period, but) i like to call it a passion i can't be sitting relaxin' (nah, i can't) pg, we getting some traction i'm at the venue, it's packed in (packed out) i'm digging her accent i got a b.b. simon belt on me and she tryna get it unfastened that's my type of distraction that's my type and she latin (that's facts, ooh) got my own flow and i'm 'bout to get a patent brand new sheets for the bed, they satin (soft, real soft) y'all wasn't tuned in back then (nah) my swag, they keep jackin' (keep on jackin') i ain't doin' no verse, quit askin' (quit askin') you might also like what's poppin'? (pooh, you a fool for this one) brand new whip, just hopped in (just hopped in) i got options i could pass that bitch like stockton (it ain't nothin') just joshin' i'ma spend this holiday locked in (ooh) my body got rid of them toxins (mmh, mmh) sportscenter, top ten7",66.0
La Difícil,Bad Bunny,"31 ContributorsTranslationsDeutschSvenskaPortuguêsFrançaisEnglishLa Difícil Lyrics[Letra de ""La Difícil""]

[Pre-Coro]
Ella desaparece, pero aparece cuando le dan gana'
Han sido un par de vece', y si e' por mí le doy to'a la semana
Se hace la que no quiere, pero llama de madrugada
Terminaste sin ropa otra ve', pidiendo que te tocara, eh-eh

[Coro]
Se hace la difícil, pero se va
Anda con la amiga siempre arrebatá'
Pidiendo que le llegue, eh (Eh)
Que a ella me entregue, eh (Eh, eh)
Pidiendo que le llegue, eh (Eh, eh)
Aunque a vece' me niegue, eh (Ey, ey, ey, ey; prra)

[Verso]
Prende, pasa, dime qué pasó (Eh)
Quería un gatito y lo cazó (Lo cazó)
De la' relacione' se cansó (Ja)
La última que tuvo la atrasó (Ja; wuh)
Tú la ve' en el VIP, modelo como Hadid
Invicta como Khabib
Má' de cien cabrone' que ella deja en read (Read)
A vece' la' rola' y la weed (Weed)
Una estrella porno, chinga como Riley Reid (Wuh)
You might also like[Puente]
Tiene a to' lo' nene' loco y a la nena' loca' (Loca')
To' quieren besarle la boca, ey
Mírala cómo se toca (Wuh; se toca, se toca, se toca)
Bailando e' que me provoca
Tiene a to' lo' nene' loco y a la nena' loca' (Loca')
To' quieren besarle la boca, ey
Mírala cómo se toca (Se toca, se toca, se toca, ey)
Perreando e' que me provoca (¡Wuh!)

[Coro]
Se hace la difícil, pero se va
Anda con la amiga siempre arrebatá', ah-ah
Pidiendo que le llegue, eh
Que a ella me entregue, eh
Pidiendo que le llegue, eh
Aunque a vece' me niegue, eh (Ey, ey, ey, ey)

[Post-Coro]
Prende, pasa, dime qué pasó
Pre-Prende, pasa, dime qué pasó
Pre-Prende, pasa, dime qué pasó
Dime, qué pasó, ey
Tiene a to' lo' nene' loco y a la nena' loca', loca', loca', loca'
Tiene a to' lo' nene' loco y a la nena' loca', loca', loca', loca'
[Outro]
Eh-eh-eh, eh-eh-eh
Súbelo NEO
La Paciencia, ey
Bad Bunny, baby, bebé, eh, eh, eh
Bad Bunny, baby, bebé, eh, eh, eh
Wuh10Embed","['Lennex', 'Mora', 'Freddy “El Syntethyzer”', 'Phantom (Producer)', 'Bad Bunny']","['Lennex', 'Subelo NEO', 'Mora']",5305001,0.685,0.848,8,-4.561,0,0.0858,0.0861,7.14e-06,0.0783,0.761,179.87,audio_features,6NfrH0ANGmgBXyxgV2PeXt,spotify:track:6NfrH0ANGmgBXyxgV2PeXt,https://api.spotify.com/v1/tracks/6NfrH0ANGmgBXyxgV2PeXt,https://api.spotify.com/v1/audio-analysis/6NfrH0ANGmgBXyxgV2PeXt,163084,4,"   ella desaparece, pero aparece cuando le dan gana' han sido un par de vece', y si e' por mí le doy to'a la semana se hace la que no quiere, pero llama de madrugada terminaste sin ropa otra ve', pidiendo que te tocara, eh-eh   se hace la difícil, pero se va anda con la amiga siempre arrebatá' pidiendo que le llegue, eh (eh) que a ella me entregue, eh (eh, eh) pidiendo que le llegue, eh (eh, eh) aunque a vece' me niegue, eh (ey, ey, ey, ey; prra)   prende, pasa, dime qué pasó (eh) quería un gatito y lo cazó (lo cazó) de la' relacione' se cansó (ja) la última que tuvo la atrasó (ja; wuh) tú la ve' en el vip, modelo como hadid invicta como khabib má' de cien cabrone' que ella deja en read (read) a vece' la' rola' y la weed (weed) una estrella porno, chinga como riley reid (wuh) you might also like tiene a to' lo' nene' loco y a la nena' loca' (loca') to' quieren besarle la boca, ey mírala cómo se toca (wuh; se toca, se toca, se toca) bailando e' que me provoca tiene a to' lo' nene' loco y a la nena' loca' (loca') to' quieren besarle la boca, ey mírala cómo se toca (se toca, se toca, se toca, ey) perreando e' que me provoca (¡wuh!)   se hace la difícil, pero se va anda con la amiga siempre arrebatá', ah-ah pidiendo que le llegue, eh que a ella me entregue, eh pidiendo que le llegue, eh aunque a vece' me niegue, eh (ey, ey, ey, ey)   prende, pasa, dime qué pasó pre-prende, pasa, dime qué pasó pre-prende, pasa, dime qué pasó dime, qué pasó, ey tiene a to' lo' nene' loco y a la nena' loca', loca', loca', loca' tiene a to' lo' nene' loco y a la nena' loca', loca', loca', loca'  eh-eh-eh, eh-eh-eh súbelo neo la paciencia, ey bad bunny, baby, bebé, eh, eh, eh bad bunny, baby, bebé, eh, eh, eh wuh1",72.0
In Your Eyes,The Weeknd,"157 ContributorsTranslationsTürkçeEspañolРусскийPortuguêsDeutsch한국어FrançaisفارسیThe Weeknd - In Your Eyes (Përkthim në Shqip)PolskiItalianoDanskSvenskaالعربيةIn Your Eyes Lyrics[Verse 1]
I just pretend that I'm in the dark and
I don't regret 'cause my heart can't take a loss
I'd rather be so oblivious
I'd rather be with you

[Pre-Chorus]
When it's said, when it's done, yeah
I don't ever wanna know
I can tell what you done, yeah
When I look at you

[Chorus]
In your eyes
I see there's something burning inside you
Oh, inside you
In your eyes
I know it hurts to smile, but you try to
Oh, you try to
You always try to hide the pain
You always know just what to say
I always look the other way
I'm blind, I'm blind
In your eyes
You lie, but I don't let it define you
Oh, define you
See The Weeknd LiveGet tickets as low as $88You might also like[Verse 2]
I tried to find love
In someone else too many times
But I hope you know I mean it (Mean it)
When I tell you you're the one that was on my mind, oh

[Pre-Chorus]
When it's said, when it's done, yeah
I would never let you know (Let you know)
I'm ashamed of what I've done, yeah
When I look at you

[Chorus]
In your eyes (Your eyes)
I see there's something burning inside you (Inside you)
Oh, inside you (Oh, inside you)
In your eyes
I know it hurts to smile, but you try to (But you try to)
Oh, you try to (You try to)
You always try to hide the pain (Oh, oh)
You always know just what to say (Oh, dear)
I always look the other way
I'm blind, I'm blind
In your eyes
You lie, but I don't let it define you (Hey)
Oh, define you
[Chorus]
In your eyes
I see there's something burning inside you
Oh, inside you
You always try to hide the pain
You always know just what to say
I always look the other way
I'm blind, I'm blind
In your eyes
You lie, but I don't let it define you
Oh, define you98Embed","['The Weeknd', 'Belly', 'Max Martin', 'Oscar Holter']","['Max Martin', 'Oscar Holter', 'The Weeknd']",5360217,0.667,0.719,7,-5.371,0,0.0346,0.0028,7.92e-05,0.0736,0.718,100.019,audio_features,7szuecWAPwGoV1e5vGu8tl,spotify:track:7szuecWAPwGoV1e5vGu8tl,https://api.spotify.com/v1/tracks/7szuecWAPwGoV1e5vGu8tl,https://api.spotify.com/v1/audio-analysis/7szuecWAPwGoV1e5vGu8tl,237520,4," i just pretend that i'm in the dark and i don't regret 'cause my heart can't take a loss i'd rather be so oblivious i'd rather be with you   when it's said, when it's done, yeah i don't ever wanna know i can tell what you done, yeah when i look at you   in your eyes i see there's something burning inside you oh, inside you in your eyes i know it hurts to smile, but you try to oh, you try to you always try to hide the pain you always know just what to say i always look the other way i'm blind, i'm blind in your eyes you lie, but i don't let it define you oh, define you see the weeknd liveget tickets as low as $you might also like i tried to find love in someone else too many times but i hope you know i mean it (mean it) when i tell you you're the one that was on my mind, oh   when it's said, when it's done, yeah i would never let you know (let you know) i'm ashamed of what i've done, yeah when i look at you   in your eyes (your eyes) i see there's something burning inside you (inside you) oh, inside you (oh, inside you) in your eyes i know it hurts to smile, but you try to (but you try to) oh, you try to (you try to) you always try to hide the pain (oh, oh) you always know just what to say (oh, dear) i always look the other way i'm blind, i'm blind in your eyes you lie, but i don't let it define you (hey) oh, define you  in your eyes i see there's something burning inside you oh, inside you you always try to hide the pain you always know just what to say i always look the other way i'm blind, i'm blind in your eyes you lie, but i don't let it define you oh, define you9",75.0
Prisoner (feat. Dua Lipa),Miley Cyrus,"103 ContributorsTranslationsTürkçeEspañolСрпскиPortuguêsItalianoDeutschFrançaisفارسیالعربيةPolskiPrisoner Lyrics[Intro: Miley Cyrus]
Prisoner, prisoner, locked up
Can't get you off my mind, off my mind
Lord knows I tried a million times, million times, oh-woah
Why can't you, why can't you just let me go?

[Verse 1: Dua Lipa & Miley Cyrus]
Strung out on a feeling, my hands are tied
Your face on my ceiling, I fantasize
Oh, I can't control it, I can't control it (I can't control it)
I try to replace it with city lights
I'll never escape it, I need the high
Oh, I can't control it, I can't control it (Oh)

[Pre-Chorus: Miley Cyrus]
You keep making it harder to stay
But I still can't run away
I gotta know why can't you, why can't you just let me go?

[Chorus: Dua Lipa & Miley Cyrus]
Prisoner, prisoner, locked up
Can't get you off my mind, off my mind
Lord knows I tried a million times, million times, oh-woah
Why can't you, why can't you just let me go?
Prisoner, prisoner, locked up
Can't get you off my mind, off my mind
Lord knows I tried a million times, million times, oh-woah
Why can't you, why can't you just let me go?
You might also like[Verse 2: Miley Cyrus]
I tasted Heaven, now I can't live without it
I can't forget you and your love is the loudest
Oh, I can't control it, I can't control it (Can't control it)

[Pre-Chorus: Dua Lipa, Miley Cyrus & Both]
You keep making it harder to stay (Oh, ah)
But I still can't run away
I gotta know, why can't you, why can't you just let me go?

[Chorus: Miley Cyrus, Dua Lipa & Both]
Prisoner, prisoner, locked up
Can't get you off my mind, off my mind
Lord knows I tried a million times, million times, oh-woah
Why can't you, why can't you just let me go?
Prisoner, prisoner, locked up
Can't get you off my mind, off my mind (Off my mind)
Lord knows I tried a million times, million times, oh-woah
Why can't you, why can't you just let me go?

[Outro: Miley Cyrus, Dua Lipa & Both]
Can't get you off my mind
Why can't you just let me go?
Million times
I wanna know why can't you, why can't you
I wanna know why can't you, why can't you
I gotta know why can't you, why can't you just let me go?112Embed","['Jon Bellion', 'Stefan Johnson', 'MarcLo', 'Jordan K. Johnson', 'Miley Cyrus', 'Dua Lipa', 'Ali Tamposi', 'watt']","['Jon Bellion', 'The Monsters & Strangerz', 'watt']",6131378,0.781,0.67,3,-3.912,0,0.0452,0.0103,0.0,0.0761,0.595,127.99,audio_features,5JqZ3oqF00jkT81foAFvqg,spotify:track:5JqZ3oqF00jkT81foAFvqg,https://api.spotify.com/v1/tracks/5JqZ3oqF00jkT81foAFvqg,https://api.spotify.com/v1/audio-analysis/5JqZ3oqF00jkT81foAFvqg,169333,4," prisoner, prisoner, locked up can't get you off my mind, off my mind lord knows i tried a million times, million times, oh-woah why can't you, why can't you just let me go?   strung out on a feeling, my hands are tied your face on my ceiling, i fantasize oh, i can't control it, i can't control it (i can't control it) i try to replace it with city lights i'll never escape it, i need the high oh, i can't control it, i can't control it (oh)   you keep making it harder to stay but i still can't run away i gotta know why can't you, why can't you just let me go?   prisoner, prisoner, locked up can't get you off my mind, off my mind lord knows i tried a million times, million times, oh-woah why can't you, why can't you just let me go? prisoner, prisoner, locked up can't get you off my mind, off my mind lord knows i tried a million times, million times, oh-woah why can't you, why can't you just let me go? you might also like i tasted heaven, now i can't live without it i can't forget you and your love is the loudest oh, i can't control it, i can't control it (can't control it)   you keep making it harder to stay (oh, ah) but i still can't run away i gotta know, why can't you, why can't you just let me go?   prisoner, prisoner, locked up can't get you off my mind, off my mind lord knows i tried a million times, million times, oh-woah why can't you, why can't you just let me go? prisoner, prisoner, locked up can't get you off my mind, off my mind (off my mind) lord knows i tried a million times, million times, oh-woah why can't you, why can't you just let me go?   can't get you off my mind why can't you just let me go? million times i wanna know why can't you, why can't you i wanna know why can't you, why can't you i gotta know why can't you, why can't you just let me go?11",1.0
