Track Name,Artist Name,Lyrics,Writers,Producers,Genius_ID,danceability,energy,key,loudness,mode,speechiness,acousticness,instrumentalness,liveness,valence,tempo,type,id,uri,track_href,analysis_url,duration_ms,time_signature,clean_lyrics,Popularity
Life Is Good (feat. Drake),Future,"223 ContributorsTranslationsРусскийPortuguêsFrançaisLife Is Good Lyrics[Part I]

[Chorus: Drake]
Workin' on a weekend like usual
Way off in the deep end like usual
Niggas swear they passed us, they doin' too much
Haven't done my taxes, I'm too turnt up
Virgil got a Patek on my wrist goin' nuts
Niggas caught me slippin' once, okay, so what?
Someone hit your block up, I'd tell you if it was us
Manor house in Rosewood, this shit too plush

[Verse: Drake]
Say my days are numbered, but I keep wakin' up
Know you see my texts, baby, please say some'
Wine by the glass, your man a cheapskate, huh?
Niggas gotta move off my release day, huh
Bitch, this is fame, not clout
I don't even know what that's about, watch your mouth
Baby got a ego twice the size of the crib
I can never tell her shit, it is what it is (What)
Said what I had to and did what I did (Ayy)
Never turn my back on FBG, God forbid
Virgil got the Patek on my wrist doin' front flips
Givin' you my number, but don't hit me on no dumb shit
See Future LiveGet tickets as low as $59You might also like[Chorus: Drake]
Workin' on a weekend like usual
Way off in the deep end like usual (Like usual)
Niggas swear they passed us, they doin' too much
Haven't done my taxes, I'm too turnt up
Virgil got a Patek on my wrist goin' nuts
Niggas caught me slippin' once, okay, so what?
Someone hit your block up, I'd tell you if it was us
Manor house in Rosewood, this shit too plush

[Interlude: Future]
It's cool, man, got red bottoms on
Life is good, you know what I mean? Like

[Part II]

[Chorus: Future]
Yeah, hunnid thousand for the cheapest ring on a nigga finger, lil' bitch, woo
I done flew one out to Spain to be in my domain and Audemars-ed the bitch, woo
Dropped three dollars on a ring, cost a Bentley truck, lil' bitch, woo
I was in the trap servin' cocaine, I ain't been the same since, woo

[Verse 1: Future]
Granny, she was standin' right there while I catch a play on a brick, woo
I make them lil' niggas go haywire, Taliban in this bitch, woo
I done been down bad in them trenches, had to ride with that stick, woo
Who gave you pills? Who gave you that dust? Pluto sent you on a lick, woo
Too many convicts that roll with me to play in this shit, woo
I'm tryna avoid nonsense, get Osama spray in this bitch, woo
They at the candlelight lightin' it up, nigga, anybody can get it, woo
I'm on a PJ lightin' it up, Backwood full of sticky, woo
I'm tryna tote that Draco in London and it's extended, woo
They gotta stretch a nigga out, we gon' die for this shit, woo
Yeah, I ride for my niggas, I lie to my bitch, woo
We some poor, high-class niggas, made it, we rich, yeah
I was at the bando, got a penthouse for a closet, woo
It's like a chandelier on my neck, my wrist, woo
I got pink toes that talk different languages, woo
Got Promethazine in my blood and Percocet, yeah
[Chorus: Future]
Hunnid thousand for the cheapest ring on a nigga finger, lil' bitch, woo
I done flew one out to Spain to be in my domain and Audemars-ed the bitch, woo
Dropped three dollars on a ring, cost a Bentley truck, lil' bitch, woo
I was in the trap servin' cocaine, I ain't been the same since

[Verse 2: Future]
Racks by the ton, I call up Serena
I go tremendo for new fettuccine
All fact though, carat the pinky
All fact though, we ordered the Fiji
I'm in the loop with the voo, I'm in the loop with the woo, which one you workin'?
I'll put your face on the news, I'll put the pussy on the shirt after I murk it
Then make 'em go shoot up the hearse, cost me a quarter bird, nigga, it's worth it
And you a maniac, a fuckin' alien, how you splurgin'?
Got that kitty cat, I'm havin' fun with that, goin' Birkin

[Chorus: Future]
Yeah, hunnid thousand for the cheapest ring on a nigga finger, lil' bitch, woo
I done flew one out to Spain to be in my domain and Audemars-ed the bitch, woo
Dropped three dollars on a ring, cost a Bentley truck, lil' bitch, woo
I was in the trap servin' cocaine, I ain't been the same since, woo

[Outro: Future]
Hunnid thousand for the cheapest ring on a nigga finger, lil' bitch
Hunnid thousand for the cheapest ring on a nigga finger, lil' bitch, yeah
Hunnid thousand for the cheapest ring on a nigga finger, lil' bitch, uh
Hunnid thousand for the cheapest ring on a nigga finger, lil' bitch107Embed","['Ambezza', 'OZ', 'D. Hill', 'Future', 'Drake']","['Ambezza', 'OZ', 'D. Hill']",5111026,0.676,0.609,2,-5.831,0,0.481,0.0706,0.0,0.152,0.508,142.037,audio_features,5yY9lUy8nbvjM1Uyo1Uqoc,spotify:track:5yY9lUy8nbvjM1Uyo1Uqoc,https://api.spotify.com/v1/tracks/5yY9lUy8nbvjM1Uyo1Uqoc,https://api.spotify.com/v1/audio-analysis/5yY9lUy8nbvjM1Uyo1Uqoc,237735,4,"   workin' on a weekend like usual way off in the deep end like usual niggas swear they passed us, they doin' too much haven't done my taxes, i'm too turnt up virgil got a patek on my wrist goin' nuts niggas caught me slippin' once, okay, so what? someone hit your block up, i'd tell you if it was us manor house in rosewood, this shit too plush   say my days are numbered, but i keep wakin' up know you see my texts, baby, please say some' wine by the glass, your man a cheapskate, huh? niggas gotta move off my release day, huh bitch, this is fame, not clout i don't even know what that's about, watch your mouth baby got a ego twice the size of the crib i can never tell her shit, it is what it is (what) said what i had to and did what i did (ayy) never turn my back on fbg, god forbid virgil got the patek on my wrist doin' front flips givin' you my number, but don't hit me on no dumb shit see future liveget tickets as low as $59you might also like workin' on a weekend like usual way off in the deep end like usual (like usual) niggas swear they passed us, they doin' too much haven't done my taxes, i'm too turnt up virgil got a patek on my wrist goin' nuts niggas caught me slippin' once, okay, so what? someone hit your block up, i'd tell you if it was us manor house in rosewood, this shit too plush   it's cool, man, got red bottoms on life is good, you know what i mean? like     yeah, hunnid thousand for the cheapest ring on a nigga finger, lil' bitch, woo i done flew one out to spain to be in my domain and audemars-ed the bitch, woo dropped three dollars on a ring, cost a bentley truck, lil' bitch, woo i was in the trap servin' cocaine, i ain't been the same since, woo   granny, she was standin' right there while i catch a play on a brick, woo i make them lil' niggas go haywire, taliban in this bitch, woo i done been down bad in them trenches, had to ride with that stick, woo who gave you pills? who gave you that dust? pluto sent you on a lick, woo too many convicts that roll with me to play in this shit, woo i'm tryna avoid nonsense, get osama spray in this bitch, woo they at the candlelight lightin' it up, nigga, anybody can get it, woo i'm on a pj lightin' it up, backwood full of sticky, woo i'm tryna tote that draco in london and it's extended, woo they gotta stretch a nigga out, we gon' die for this shit, woo yeah, i ride for my niggas, i lie to my bitch, woo we some poor, high-class niggas, made it, we rich, yeah i was at the bando, got a penthouse for a closet, woo it's like a chandelier on my neck, my wrist, woo i got pink toes that talk different languages, woo got promethazine in my blood and percocet, yeah  hunnid thousand for the cheapest ring on a nigga finger, lil' bitch, woo i done flew one out to spain to be in my domain and audemars-ed the bitch, woo dropped three dollars on a ring, cost a bentley truck, lil' bitch, woo i was in the trap servin' cocaine, i ain't been the same since   racks by the ton, i call up serena i go tremendo for new fettuccine all fact though, carat the pinky all fact though, we ordered the fiji i'm in the loop with the voo, i'm in the loop with the woo, which one you workin'? i'll put your face on the news, i'll put the pussy on the shirt after i murk it then make 'em go shoot up the hearse, cost me a quarter bird, nigga, it's worth it and you a maniac, a fuckin' alien, how you splurgin'? got that kitty cat, i'm havin' fun with that, goin' birkin   yeah, hunnid thousand for the cheapest ring on a nigga finger, lil' bitch, woo i done flew one out to spain to be in my domain and audemars-ed the bitch, woo dropped three dollars on a ring, cost a bentley truck, lil' bitch, woo i was in the trap servin' cocaine, i ain't been the same since, woo   hunnid thousand for the cheapest ring on a nigga finger, lil' bitch hunnid thousand for the cheapest ring on a nigga finger, lil' bitch, yeah hunnid thousand for the cheapest ring on a nigga finger, lil' bitch, uh hunnid thousand for the cheapest ring on a nigga finger, lil' bitch10",71.0
Falling,Trevor Daniel,"144 ContributorsTranslationsTürkçeSvenskaItalianoFalling Lyrics[Intro]
Oh
Ooh, ooh

[Chorus]
My last made me feel like I would never try again
But when I saw you, I felt something I never felt
Come closer, I'll give you all my love
If you treat me right, baby, I'll give you everything
My last made me feel like I would never try again
But when I saw you, I felt something I never felt
Come closer, I'll give you all my love
If you treat me right, baby, I'll give you everything

[Verse]
Talk to me, I need to hear you need me like I need ya
Fall for me, I wanna know you feel how I feel for you, love
Before you, baby, I was numb, drown out pain by pourin' up
Speedin' fast on the run, never wanna get caught up
Now you're the one that I'm callin'
Swore I thought I'd never fall again, don't think I'm just talkin'
I think I might go all in, no exceptions, girl, I need ya

[Bridge]
Feeling like I'm out of my mind, 'cause I can't get enough
Only one that I give my time, 'cause I got eyes for ya
Might make an exception for ya, 'cause I been feelin' ya
Think I might be out of my mind, I think that you're the one
You might also like[Chorus]
My last made me feel like I would never try again
But when I saw you, I felt something I never felt
Come closer, I'll give you all my love
If you treat me right, baby, I'll give you everything
My last made me feel like I would never try again
But when I saw you, I felt something I never felt
Come closer, I'll give you all my love
If you treat me right, baby, I'll give you everything

[Outro]
Will never give my all again
'Cause I'm sick of falling down
When I open up and give my trust
They find a way to break it down
Break down
Tear me up inside
When you break me down106Embed","['Martin Kottmeier', 'Tristan Norton', 'KC Supreme', 'Taz Taylor', 'Charlie Handsome', 'Trevor Daniel']","['Taz Taylor', 'Charlie Handsome', 'KC Supreme']",3994241,0.784,0.43,10,-8.756,0,0.0364,0.123,0.0,0.0887,0.236,127.087,audio_features,2rRJrJEo19S2J82BDsQ3F7,spotify:track:2rRJrJEo19S2J82BDsQ3F7,https://api.spotify.com/v1/tracks/2rRJrJEo19S2J82BDsQ3F7,https://api.spotify.com/v1/audio-analysis/2rRJrJEo19S2J82BDsQ3F7,159382,4," oh ooh, ooh   my last made me feel like i would never try again but when i saw you, i felt something i never felt come closer, i'll give you all my love if you treat me right, baby, i'll give you everything my last made me feel like i would never try again but when i saw you, i felt something i never felt come closer, i'll give you all my love if you treat me right, baby, i'll give you everything   talk to me, i need to hear you need me like i need ya fall for me, i wanna know you feel how i feel for you, love before you, baby, i was numb, drown out pain by pourin' up speedin' fast on the run, never wanna get caught up now you're the one that i'm callin' swore i thought i'd never fall again, don't think i'm just talkin' i think i might go all in, no exceptions, girl, i need ya   feeling like i'm out of my mind, 'cause i can't get enough only one that i give my time, 'cause i got eyes for ya might make an exception for ya, 'cause i been feelin' ya think i might be out of my mind, i think that you're the one you might also like my last made me feel like i would never try again but when i saw you, i felt something i never felt come closer, i'll give you all my love if you treat me right, baby, i'll give you everything my last made me feel like i would never try again but when i saw you, i felt something i never felt come closer, i'll give you all my love if you treat me right, baby, i'll give you everything   will never give my all again 'cause i'm sick of falling down when i open up and give my trust they find a way to break it down break down tear me up inside when you break me down10",54.0
Heather,Conan Gray,"214 ContributorsTranslationsEspañolFrançaisDanskTürkçeРусскийItaliano한국어العربيةPortuguêsDeutschHeather Lyrics[Verse 1]
I still remember, third of December
Me in your sweater, you said it looked better
On me than it did you, only if you knew
How much I liked you, but I watch your eyes as she

[Pre-Chorus]
Walks by
What a sight for sore eyes
Brighter than a blue sky
She's got you mesmerized while I die

[Chorus]
Why would you ever kiss me?
I'm not even half as pretty
You gave her your sweater, it's just polyester
But you like her better, wish I were Heather
[Verse 2]
Watch as she stands with her holding your hand
Put your arm 'round her shoulder, now I'm getting colder
But how could I hate her? She's such an angel
But then again, kinda wish she were dead as she

[Pre-Chorus]
Walks by
What a sight for sore eyes
Brighter than a blue sky
She's got you mesmerized while I die
See Conan Gray LiveGet tickets as low as $25You might also like[Chorus]
Why would you ever kiss me?
I'm not even half as pretty
You gave her your sweater, it's just polyester
But you like her better, I wish I were Heather

[Bridge]
(Oh)
Wish I were Heather
(Oh, oh)
Wish I were Heather

[Chorus]
Why would you ever kiss me?
I'm not even half as pretty
You gave her your sweater, it's just polyester
But you like her better, wish I were158Embed",['Conan Gray'],"['Dan Nigro', 'Jam City']",5160928,0.357,0.425,5,-7.301,1,0.0333,0.584,0.0,0.322,0.27,102.078,audio_features,4xqrdfXkTW4T0RauPLv3WA,spotify:track:4xqrdfXkTW4T0RauPLv3WA,https://api.spotify.com/v1/tracks/4xqrdfXkTW4T0RauPLv3WA,https://api.spotify.com/v1/audio-analysis/4xqrdfXkTW4T0RauPLv3WA,198040,3," i still remember, third of december me in your sweater, you said it looked better on me than it did you, only if you knew how much i liked you, but i watch your eyes as she   walks by what a sight for sore eyes brighter than a blue sky she's got you mesmerized while i die   why would you ever kiss me? i'm not even half as pretty you gave her your sweater, it's just polyester but you like her better, wish i were heather  watch as she stands with her holding your hand put your arm 'round her shoulder, now i'm getting colder but how could i hate her? she's such an angel but then again, kinda wish she were dead as she   walks by what a sight for sore eyes brighter than a blue sky she's got you mesmerized while i die see conan gray liveget tickets as low as $25you might also like why would you ever kiss me? i'm not even half as pretty you gave her your sweater, it's just polyester but you like her better, i wish i were heather   (oh) wish i were heather (oh, oh) wish i were heather   why would you ever kiss me? i'm not even half as pretty you gave her your sweater, it's just polyester but you like her better, wish i were15",84.0
Adore You,Harry Styles,"122 ContributorsTranslationsTürkçeEspañolPortuguêsPolskiDeutschBahasa IndonesiaAdore You Lyrics[Verse 1: Harry Styles]
Walk in your rainbow paradise (Paradise)
Strawberry lipstick state of mind (State of mind)
I get so lost inside your eyes
Would you believe it?

[Pre-Chorus: Harry Styles]
You don't have to say you love me
You don't have to say nothing
You don't have to say you're mine

[Chorus: Harry Styles]
Honey (Ah-ah-ah)
I'd walk through fire for you
Just let me adore you
Oh, honey (Ah-ah-ah)
I'd walk through fire for you
Just let me adore you
Like it's the only thing I'll ever do
Like it's the only thing I'll ever do

[Verse 2: Harry Styles]
Your wonder under summer skies (Summer skies)
Brown skin and lemon over ice
Would you believe it?
You might also like[Pre-Chorus: Harry Styles]
You don't have to say you love me
I just wanna tell you somethin'
Lately, you've been on my mind

[Chorus: Harry Styles]
Honey (Ah-ah-ah)
I'd walk through fire for you
Just let me adore you
Oh, honey (Ah-ah-ah)
I'd walk through fire for you
Just let me adore you
Like it's the only thing I'll ever do
Like it's the only thing I'll ever do

[Bridge: Amy Allen]
It's the only thing I'll ever do
It's the only thing I'll ever do
It's the only thing I'll ever do
It's the only thing I'll ever do
It's the only thing I'll ever do
It's the only thing I'll ever do
It's the only thing I'll ever do
It's the only thing I'll ever do

[Chorus: Harry Styles & Amy Allen]
I'd walk through fire for you
Just let me adore you
Oh, honey (Ah-ah-ah)
I'd walk through fire for you
Just let me adore you
Like it's the only thing I'll ever do (Ah-ah-ah)
(It's the only thing I'll ever do, it's the only thing I'll ever do)
I'd walk through fire for you (It's the only thing I'll ever do)
Just let me adore you
Oh, honey (Ah-ah-ah), oh, honey
(It's the only thing I'll ever do, it's the only thing I'll ever do)
I'd walk through fire for you (It's the only thing I'll ever do)
Just let me adore you (It's the only thing I'll ever do)
[Outro: Harry Styles]
Ooh, ooh
Oh, honey
Ooh, ooh
Just let me adore you
Like it's the only thing I'll ever do100Embed","['Tyler Johnson', 'Amy Allen', 'Kid Harpoon', 'Harry Styles']","['Kid Harpoon', 'Tyler Johnson']",5037350,0.676,0.771,8,-3.675,1,0.0483,0.0237,7e-06,0.102,0.569,99.048,audio_features,3jjujdWJ72nww5eGnfs2E7,spotify:track:3jjujdWJ72nww5eGnfs2E7,https://api.spotify.com/v1/tracks/3jjujdWJ72nww5eGnfs2E7,https://api.spotify.com/v1/audio-analysis/3jjujdWJ72nww5eGnfs2E7,207133,4," walk in your rainbow paradise (paradise) strawberry lipstick state of mind (state of mind) i get so lost inside your eyes would you believe it?   you don't have to say you love me you don't have to say nothing you don't have to say you're mine   honey (ah-ah-ah) i'd walk through fire for you just let me adore you oh, honey (ah-ah-ah) i'd walk through fire for you just let me adore you like it's the only thing i'll ever do like it's the only thing i'll ever do   your wonder under summer skies (summer skies) brown skin and lemon over ice would you believe it? you might also like you don't have to say you love me i just wanna tell you somethin' lately, you've been on my mind   honey (ah-ah-ah) i'd walk through fire for you just let me adore you oh, honey (ah-ah-ah) i'd walk through fire for you just let me adore you like it's the only thing i'll ever do like it's the only thing i'll ever do   it's the only thing i'll ever do it's the only thing i'll ever do it's the only thing i'll ever do it's the only thing i'll ever do it's the only thing i'll ever do it's the only thing i'll ever do it's the only thing i'll ever do it's the only thing i'll ever do   i'd walk through fire for you just let me adore you oh, honey (ah-ah-ah) i'd walk through fire for you just let me adore you like it's the only thing i'll ever do (ah-ah-ah) (it's the only thing i'll ever do, it's the only thing i'll ever do) i'd walk through fire for you (it's the only thing i'll ever do) just let me adore you oh, honey (ah-ah-ah), oh, honey (it's the only thing i'll ever do, it's the only thing i'll ever do) i'd walk through fire for you (it's the only thing i'll ever do) just let me adore you (it's the only thing i'll ever do)  ooh, ooh oh, honey ooh, ooh just let me adore you like it's the only thing i'll ever do1",83.0
you broke me first,Tate McRae,"93 ContributorsTranslationsDanskTürkçeEspañolPortuguêsItalianoFrançaisفارسیDeutschPolski​you broke me first Lyrics[Intro]
You broke me first

[Verse 1]
Maybe you don't like talkin' too much about yourself
But you shoulda told me that you were thinkin' 'bout someone else
You're drunk at a party or maybe it's just that your car broke down
Your phone's been off for a couple of months, so you're callin' me now
[Pre-Chorus]
I know you, you're like this
When shit don't go your way, you needed me to fix it
And like me, I did
But I ran out of every reason

[Chorus]
Now suddenly, you're askin' for it back
Could you tell me, where'd you get the nerve?
Yeah, you could say you miss all that we had
But I don't really care how bad it hurts
When you broke me first
You broke me first

[Verse 2]
Took a while, was in denial when I first heard
That you moved on quicker than I could've ever, you know that hurt
Swear for a while, I would stare at my phone just to see your name
But now that it's there, I don't really know what to say
See Tate McRae LiveGet tickets as low as $54You might also like[Pre-Chorus]
I know you, you're like this
When shit don't go your way, you needed me to fix it
And like me, I did
But I ran out of every reason

[Chorus]
Now suddenly, you're askin' for it back
Could you tell me, where'd you get the nerve?
Yeah, you could say you miss all that we had
But I don't really care how bad it hurts
When you broke me first
You broke me first
[Bridge]
What did you think would happen?
What did you think would happen?
I'll never let you have it
What did you think would happen?

[Chorus]
Now suddenly, you're askin' for it back
Could you tell me, where'd you get the nerve?
Yeah, you could say you miss all that we had
But I don't really care how bad it hurts
When you broke me first
You broke me first (You broke me first)
You broke me first, ooh-oh71Embed","['Victoria Zaro', 'Blake Harnage', 'Tate McRae']",['Blake Harnage'],5453929,0.667,0.373,4,-9.389,1,0.05,0.785,0.0,0.0906,0.0823,124.148,audio_features,45bE4HXI0AwGZXfZtMp8JR,spotify:track:45bE4HXI0AwGZXfZtMp8JR,https://api.spotify.com/v1/tracks/45bE4HXI0AwGZXfZtMp8JR,https://api.spotify.com/v1/audio-analysis/45bE4HXI0AwGZXfZtMp8JR,169266,4," you broke me first   maybe you don't like talkin' too much about yourself but you shoulda told me that you were thinkin' 'bout someone else you're drunk at a party or maybe it's just that your car broke down your phone's been off for a couple of months, so you're callin' me now  i know you, you're like this when shit don't go your way, you needed me to fix it and like me, i did but i ran out of every reason   now suddenly, you're askin' for it back could you tell me, where'd you get the nerve? yeah, you could say you miss all that we had but i don't really care how bad it hurts when you broke me first you broke me first   took a while, was in denial when i first heard that you moved on quicker than i could've ever, you know that hurt swear for a while, i would stare at my phone just to see your name but now that it's there, i don't really know what to say see tate mcrae liveget tickets as low as $54you might also like i know you, you're like this when shit don't go your way, you needed me to fix it and like me, i did but i ran out of every reason   now suddenly, you're askin' for it back could you tell me, where'd you get the nerve? yeah, you could say you miss all that we had but i don't really care how bad it hurts when you broke me first you broke me first  what did you think would happen? what did you think would happen? i'll never let you have it what did you think would happen?   now suddenly, you're askin' for it back could you tell me, where'd you get the nerve? yeah, you could say you miss all that we had but i don't really care how bad it hurts when you broke me first you broke me first (you broke me first) you broke me first, ooh-oh7",21.0
